,Filename,text,language
0,ben_0358.wav,nirbachito nibandh Gulo Wikipedia Sher nibandh,bengali
0,ben_0359.wav,Russian Big can we forget Pratham Pradhan Children doctor,bengali
0,ben_0360.wav,Dollar to theek ho 31 in Ho,bengali
0,ben_0361.wav,chalo Chitra t porichalona college Steven Spielberg,bengali
0,ben_0362.wav,Amisha pure bhabhi catch Kori,bengali
0,ben_0363.wav,apni angreji hui ki Dekhe niche pan,bengali
0,ben_0364.wav,Parineeti Chopra made by Shikha Pratishthan hisab shikriti Labh kare,bengali
0,ben_0365.wav,dukher Karan Hote Hai an actor by Parichay,bengali
0,ben_0366.wav,Annu being so satabdir maja machi show my Hote baysquare netrutva,bengali
0,ben_0367.wav,Karun Bangali chikitsak Nami Itti category,bengali
0,ben_0368.wav,Amar Hata Kshetra Kono reference boy name,bengali
0,ben_0369.wav,Bangladeshi exam broker Tu Mahila open Nashik,bengali
0,ben_0370.wav,ko Bolo pida Tara chhayapath Itna Dil Ko t,bengali
0,ben_0371.wav,Ghare baire Re Chalo Chitra Upar Neela bakore Chitra Chitra,bengali
0,ben_0372.wav,Udhar Alaap Pata Saraswati aamantran Janu,bengali
0,ben_0373.wav,Pradhan Pathak ke padarth aur Madhyam Mein padarth Vigyan Pravesh Kora Dakshina,bengali
0,ben_0374.wav,Dhaka Vishwavidyalaya Itihaas upore Bhalo cause was,bengali
0,ben_0375.wav,watch Chor nibandh Odisha DK,bengali
0,ben_0376.wav,Maulik Shankar Sampark ki to 31 samosa,bengali
0,ben_0377.wav,tarashankar Bandopadhyay rochito economic Ekti Upanishad cholochitro Roop,bengali
0,ben_0378.wav,Kudi gram Jila vibhinn Upar Jila Sampark,bengali
0,ben_0379.wav,Apna rashad Jo Karle Amar Suvidha hobby,bengali
0,ben_0380.wav,army ki Kot poriborton korbo shut up Bole Bhalo hai,bengali
0,ben_0381.wav,Bangladeshi Prachin nidarshan guler unnatam,bengali
0,ben_0382.wav,Shahar Uttar Pradesh puratan Brahmaputra nadi upsthit,bengali
0,ben_0383.wav,Bangla actor Kichu actor coda ichcha chilo,bengali
0,ben_0384.wav,Holi ki email Kore ke Janiya,bengali
0,ben_0385.wav,bhai sahab Jo Todkar on Taraf Tu caller tune no,bengali
0,ben_0386.wav,nibandh the Jara Kanch ko today Roshan ko dhanyvad,bengali
0,ben_0387.wav,ETA Prachin kal actor Rajjo chilo,bengali
0,ben_0388.wav,Kalu Rasta sarthebari broker to Bhartiya Bengali sahityik Sunil Gangopadhyay rochito active Panache,bengali
0,ben_0389.wav,Ganga nadi Bharat aur Bangladesh,bengali
0,ben_0390.wav,to Kumta boys chhilo matro 20,bengali
0,ben_0391.wav,flower pot Thakur to Jersey Ho Lal Poshak Poshak Sada Rohit Mishra,bengali
0,ben_0392.wav,Tirupur Rajdhani Dhaka shop chenikuthi Cadet College,bengali
0,ben_0393.wav,are Jo tablet,bengali
0,ben_0394.wav,dhaatu Bangla baccarin dhaatu,bengali
0,ben_0395.wav,apni ki banglapedia Sathi porichito Wikipedia Holo Shahid active vishwakosh,bengali
0,ben_0396.wav,Dhaka Vishwavidyalay Upar chat show,bengali
0,ben_0397.wav,ITI Africa Shakti Rashtra Sankranti nibandh,bengali
0,ben_0398.wav,Photoshop Pratham AVN kuthama Grah,bengali
0,ben_0399.wav,angreji Bhasha chalachitra t porichalona collagen Steven Spielberg,bengali
0,ben_0400.wav,Utsav somporke Khoob Basa Kichu Jani na,bengali
0,ben_0401.wav,Bhai Jara agrohi ka darshan,bengali
0,ben_0402.wav,Ami Bangladesh nibandh Lal link Gulo Ke Neel Kochi,bengali
0,ben_0403.wav,Vahi Pata Tha ki vibhinn Bhasha pratipurti coronavirus Jonno nijoshyo link Daya acche,bengali
0,ben_0404.wav,Kintu Ek khane Ghosh havena Saptarshi,bengali
0,ben_0405.wav,Partha began Mujhe falana Sathi ki it is important to do it to Dekho,bengali
0,ben_0406.wav,Wikipedia Bangla Banane Niyam a Jaaye,bengali
0,ben_0407.wav,Army Shahid chhatron computer Anna,bengali
0,ben_0408.wav,Kintu Pakistan Amol Bongo Bondhu Amar Mone hoy na Parivartan Aadhar card,bengali
0,ben_0409.wav,Muli shankha Guli purple likha Jack,bengali
0,ben_0410.wav,papa to ki chhut in ho to be sure Mein tyohar Sambhav havena,bengali
0,ben_0411.wav,tikuli Hai To theek Hote paare,bengali
0,ben_0412.wav,short Shapath Kranti Shanti par active pad Rahi to,bengali
0,ben_0413.wav,asali Army base ki chhut in Java 8 angreji Vicky Kajla Kochi,bengali
0,ben_0414.wav,Aku no nibandh on road thak Le Jana ban,bengali
0,ben_0415.wav,vishwakosh bolte ki bojho tar actor Dhaar Hona amada competition,bengali
0,ben_0416.wav,it is food chain Shobha pakka nikat Grah,bengali
0,ben_0417.wav,Tu Khoon Aadha kar Ato Kache tha Kaha Bana,bengali
0,ben_0418.wav,nirbachito Chobi nirbachito nibandh niche Diye Dekh la,bengali
0,ben_0419.wav,top apni kachra liye junction Dekhe Bhalo laglo,bengali
0,ben_0420.wav,Aage Holi a Gai Kore Debo,bengali
0,ben_0421.wav,Tini Bulletin chotoder golpo uponnash likha Jo bich Hai Tu,bengali
0,ben_0422.wav,31 Sampoorna aur nirbhar jogo vishwakosh a point Hawa Wikipedia Loko,bengali
0,ben_0423.wav,Amoeba Nahin Bhul Kot Ustad,bengali
0,ben_0424.wav,it is of the Hai Do Bar prakashit Ho To,bengali
0,ben_0425.wav,Tarzan movie chilo Ekti daridra parivar,bengali
0,ben_0426.wav,Kothi utaral padarth to Rona a Gaya apekshik aayatan on ekvirechi,bengali
0,ben_0427.wav,Kintu dukher Bijoy bolti rachayitha Kono proyojon Anubhav Colony,bengali
0,ben_0428.wav,Ta Chita me ostrich kilo wali rupo ka niyantran,bengali
0,ben_0429.wav,Baki onshore Hote Uttar Ireland Jhuk Tu Raja Ki Chhori ok show,bengali
0,ben_0430.wav,Bankim Chandra Chattopadhyay Ekti Bangla uponnash,bengali
0,ben_0431.wav,Asima Bade sabse prasiddh Rachna Hote Foundation series,bengali
0,ben_0432.wav,Etah activeness Hathi to dhaatu,bengali
0,ben_0433.wav,Robi Shankar chillin Char bhaiyon buddhe shop chhoto,bengali
0,ben_0434.wav,Manchester United Lal link prices,bengali
0,ben_0435.wav,ETA actor Wikipedia Wikipedia Wikipedia arrowbc obodan Rakha Jonno Ekti prokolpo,bengali
0,ben_0436.wav,check project on trade Itihaas aur Sanskriti samriddh,bengali
0,ben_0437.wav,Unnati ke chattagram Vishwavidyalay upachar Jo Dor,bengali
0,ben_0438.wav,we also need prodhan nibandh hollow on go,bengali
0,ben_0439.wav,Ami Amar Allah Pata Dekhte page,bengali
0,ben_0440.wav,Jyoti na Kore Ki Kore Amay ektu Kore,bengali
0,ben_0441.wav,parade duty nibandh angreji wicket acche AVN tar take a human hoec anuvad,bengali
0,ben_0442.wav,2000 kudi Wikipedia Bangla bhasha videshi Shabd Prati Dekhun sekhan kar Pata Montu Bura ko,bengali
0,ben_0443.wav,tar Pradhan equation chilo gonit padarth Vigyan Opera Kaushal,bengali
0,ben_0444.wav,80 dudh Khub Kono Kore toiri Kora hoy,bengali
0,ben_0445.wav,Holi ki 80 Na Main Sudhu Bangali cholochitro Deva theek ho,bengali
0,ben_0446.wav,$1 chillin ilaka Shanti comedy neta,bengali
0,ben_0447.wav,Lisa beauty Sanskrit Bhasha take a s h a,bengali
0,ben_0448.wav,muktijoddha shuruaat 3 Pakistani tatkalin Paschim Pakistan chillin,bengali
0,ben_0449.wav,Shuru Kochi shudhu Je Tara Dhaka Vishwavidyalay,bengali
0,ben_0450.wav,kabutar Bole Kabutar Se,bengali
0,ben_0451.wav,Vishva Bani Jo bortoman show the show show more,bengali
0,ben_0452.wav,polli bornomala Amar Gan Anuj joke Kochi,bengali
0,ben_0453.wav,Bhilai bhai process of their aalochana Pata dekh le,bengali
0,ben_0454.wav,Pili ko actor Kobita Shuru Kore Jabo,bengali
0,ben_0455.wav,Shankar Amazon Bharti Bengali lekhak,bengali
0,ben_0456.wav,Bangladesh ticket Bangla bhasha prakashit O Sambad Patra,bengali
0,ben_0457.wav,Apna 1989,bengali
0,ben_0458.wav,Paschim Europe Electronics shop,bengali
0,ben_0459.wav,American gift to Coimbatore,bengali
0,ben_0460.wav,sridhara Nagori ka short Maar Dai,bengali
0,ben_0461.wav,503 II Pakistan pratirodh ka montronaloy began Vishal,bengali
0,ben_0462.wav,copyright hollow 24 ji website Praman,bengali
0,ben_0463.wav,Alok Sagar Bharat Mahasagar also,bengali
0,ben_0464.wav,Afghanistan bohu picture jaatishwar Shabash,bengali
0,ben_0465.wav,Jaan Tomar Naam r g kar Medical College,bengali
0,ben_0466.wav,Royal Bengal Bagh Bharat Bangladeshi jatiyo Pashu,bengali
0,ben_0467.wav,latest showroom ko Khub Choto,bengali
0,ben_0468.wav,yah Desh Shankar bortoman a loco,bengali
0,ben_0469.wav,rajshahi Vishwavidyalay dog,bengali
0,ben_0470.wav,angreji wicket nibandh Hotel Onyx Amritsar,bengali
0,ben_0471.wav,Java deep Bharat Mahasagar,bengali
0,ben_0472.wav,sheti Vishay shop jonoprio uddami football league,bengali
0,ben_0473.wav,igloo Amar Bhai Tola chobi,bengali
0,ben_0474.wav,Avengers Alaipayuthey Apna prashna Uttar,bengali
0,ben_0475.wav,Babar Naam tar pratishthit pratishthan's Naam rakhen,bengali
0,ben_0476.wav,Apna got both ETA kurte party,bengali
0,ben_0477.wav,Britain action wishes Pradhan O brame automatic Shoti Tiller,bengali
0,ben_0478.wav,Dr Mohd Shahid Ullah shop show me Shahid Sathi film,bengali
0,ben_0479.wav,in Shankar bhejo na khol de sakti ho,bengali
0,ben_0480.wav,Paschim Banga rajya Uttar 24 Pargana Zilla,bengali
0,ben_0481.wav,Satyajeet Rai rochito feluda goyenda Kahini series,bengali
0,ben_0482.wav,are power Dhaka Vishwavidyalay Chhatra Hawa,bengali
0,ben_0483.wav,cortona chilo Bharati Prothom,bengali
0,ben_0484.wav,Apna Desh Ham padana thi ki Ammi Puchte 1 Din nibandh ki bhabe likhte hai,bengali
0,ben_0485.wav,Vivo Chhod Kyon Prothom Vibhag Pani,bengali
0,ben_0486.wav,moolam 2 songs British Ishwar Shabd taking a shop,bengali
0,ben_0487.wav,can you it is Suvidha Chetan,bengali
0,ben_0488.wav,Kunti babohar korte hobe Re Khushi Hobo,bengali
0,ben_0489.wav,kurti Hugli nadi avasthit,bengali
0,ben_0490.wav,Alok bhai apna ko Thi theek,bengali
0,ben_0491.wav,apni Jyoti e Sampark a Kichu Jante taaja Naat a pak Ki Tilawat,bengali
0,ben_0492.wav,Munna baad Apna ki ful khojen belpada Jonno,bengali
0,ben_0493.wav,Prachin Kal ke chinh Prithvi Pradhan photo,bengali
0,ben_0494.wav,Manipuri Bangladeshi adivasi Goshti,bengali
0,ben_0495.wav,apni jaane ki Wikipedia prodhan Pata Ekti Osho,bengali
0,ben_0496.wav,Ami Moner Kudi Rajniti samikaran basic,bengali
0,ben_0497.wav,Atul Prakash broker to bhartiyon Bengali sahityik Sunil Gangopadhyay rochito Prothom Upar Nache,bengali
0,ben_0498.wav,Ti Ne padha likha Kolkata Hare School Hindu College Presidency College,bengali
0,ben_0499.wav,asali Niharika ko Chaya paath,bengali
0,ben_0500.wav,tar Baba Chalein episode magistrate,bengali
0,ben_0501.wav,substitute for Luminous,bengali
0,ben_0502.wav,Bangla Bangladeshi X Ti Pol jonoprio band,bengali
0,ben_0503.wav,ITI Islamic Prothom Boro Jodhpur,bengali
0,ben_0504.wav,NTPC 20 August 8,bengali
0,ben_0505.wav,Bobby Satya Aro Sundar Kintu,bengali
0,ben_0506.wav,program College School program college,bengali
0,ben_0507.wav,Gautam Ghosh attitude Bharati Bangali cholochitro porichalok,bengali
0,ben_0508.wav,a promise that a bomb Dhaka described but police horn,bengali
0,ben_0509.wav,kishorganj scheduled for July August 31,bengali
0,ben_0510.wav,rasayanik Bandhan Dwara song Jhukta,bengali
0,ben_0511.wav,Bhasha Teer Jay shop Likhit only Darshan ke acche se bolo to Sahitya group,bengali
0,ben_0512.wav,ITI Bangladeshi Prothom public Vishwavidyalay,bengali
0,ben_0513.wav,Daya coding Jodhpur Jayega Bhool bananti acche Tak theek kara vyavastha Nahin,bengali
0,ben_0514.wav,HBT vibhinn no Granth,bengali
0,ben_0515.wav,arthat Arthik Bazar poriborton Kothi,bengali
0,ben_0516.wav,is falling Dil Ko Din Ta ke Shahid Kapoor ke,bengali
0,ben_0517.wav,tar gane Khoob Bhalo Bajar,bengali
0,ben_0518.wav,Asha Kudi Pata apni,bengali
0,ben_0519.wav,Jahan Par Bhandara upload coronavirus,bengali
0,ben_0520.wav,time nibandh Roti ke aage August serial killer,bengali
0,ben_0521.wav,slow motion I am,bengali
0,ben_0522.wav,ITI job short July August written,bengali
0,ben_0523.wav,Bangladeshi Pala Boothu short program on Sholay,bengali
0,ben_0524.wav,shop Sabha bich Shankar jewellery,bengali
0,ben_0525.wav,tahole Ami thik Kore korbo,bengali
0,ben_0526.wav,Ti Ne Do Bar Oscar Puraskar Bijoy,bengali
0,ben_0527.wav,Dr Mohammad shahidullah owner qualification,bengali
0,ben_0528.wav,Bhartiya Bengali sahityik Sunil Gangopadhyay rochito Ekti Upar Nache,bengali
0,ben_0529.wav,Pratik bara so anacrotic Holo Prakash,bengali
0,ben_0530.wav,Wikipedia template is babohar base gutor gu,bengali
0,ben_0531.wav,AK mote portion korar Jonno dhonnobad on a catch,bengali
0,ben_0532.wav,Dukhi Meru prithibir shop Dukhi Ne avasthit Bindu,bengali
0,ben_0533.wav,Ek karo Ne Manav jaati Prati fallen Boond visheshta,bengali
0,ben_0534.wav,Bangla PT II Asiatic Society of Bangladesh Kotak prakashit O exhibition,bengali
0,ben_0535.wav,ekmatra ji doll three jite Chale Tharo Manchester United,bengali
0,ben_0536.wav,Julu Jati ka itihas best Samrat,bengali
0,ben_0537.wav,define promote Satakli Jana Bank,bengali
0,ben_0538.wav,3 e-prothom main Thodi proportionally Shakti utpadan ka Jaaye,bengali
0,ben_0539.wav,special wishes to sahityik Parichay Shuru Hai,bengali
0,ben_0540.wav,bongobondhu Sheikh Mujibur Rahman ke coronavirus,bengali
0,ben_0541.wav,apni Bhalo Tha Ke Apna Bhalo tha Ka utpann Tu Jaruri,bengali
0,ben_0542.wav,cable Kajal Mukher Bhasha today with Sudhar,bengali
0,ben_0543.wav,Bangladeshi Rajdhani 18 Dhaka shahar,bengali
0,ben_0544.wav,ATM Khol Vishay sarvadhik burrito Indur Mara beach,bengali
0,ben_0545.wav,1 on 1 tablet Hote Hote,bengali
0,ben_0546.wav,airport Taki in hidden jyotirvigyan port Lekha Ekti boy,bengali
0,ben_0547.wav,Naina se nibandh Taki Joker Ami bujhte Fortuner,bengali
0,ben_0548.wav,Talking Cat Jodi apni monoposto Petha is Jonno Ami khubi Dukhi,bengali
0,ben_0549.wav,bolo to vinodhara Utha Ke Bande,bengali
0,ben_0550.wav,Uttam Kumar avinito Ekti jonoprio chalachitra,bengali
0,ben_0551.wav,poppy apni Jyada Chester,bengali
0,ben_0552.wav,Teeny tatkal in British Bharat Prothom mohila startup,bengali
0,ben_0553.wav,Mount Abu,bengali
0,ben_0554.wav,Baba Chilam Imam,bengali
0,ben_0555.wav,Hindi cinema sangeet Upar tar Prabhav account Vishal,bengali
0,ben_0556.wav,best Aane Gali Bhasha Hindi bhasha,bengali
0,ben_0557.wav,Army nibandh Roti song Pradhan koda,bengali
0,ben_0558.wav,Mumbai Bharat Bani chik Vinod Rajdhani,bengali
0,ben_0559.wav,internet l madhumeh Ekti computer is Sathi erector computer is jokes Thakur udaharan,bengali
0,ben_0560.wav,bortoman Amar Pradhan Agro ke Vishal Holo Itihaas,bengali
0,ben_0561.wav,free hoke shokti hisabe juktorasto aur Soviet Union Uttar Pradesh,bengali
0,ben_0562.wav,dpo Bhasha Arjun 42 Bhasha Vigyan ko Vishwanath actor Vishal goes to,bengali
0,ben_0563.wav,rajshahi popular bagoda AVN sirajganj,bengali
0,ben_0564.wav,FIFA Vishwa Cup Trophy FIFA Vishwa Cup site,bengali
0,ben_0565.wav,Kintu Lekha ki pauri to Ek nibandh,bengali
0,ben_0566.wav,bilayat IATA code DHL,bengali
0,ben_0567.wav,Maha Vishnu Puran Vishnu Puran,bengali
0,ben_0568.wav,Tekken 3 ki Bullet Ta sahityik Jivan sutrapada,bengali
0,ben_0569.wav,Aaru on Xmas Rituparna Rachana collection,bengali
0,ben_0570.wav,Rakhi bhai apna office ka Kursi,bengali
0,ben_0571.wav,elective paper follow coronavirus,bengali
0,ben_0572.wav,Tu khinch simana chhilo bortoman Bangladeshi Dhaka AVN motion khojela,bengali
0,ben_0573.wav,architect Palli template to cast on a Jaaye to,bengali
0,ben_0574.wav,nibandh shiranami partly through our nibandh think quality,bengali
0,ben_0575.wav,projukti shopwati link taking bath delay,bengali
0,ben_0576.wav,PK of product is vibhinn I wish it was,bengali
0,ben_0577.wav,Pita Naam Jagannath Bhattacharjee,bengali
0,ben_0578.wav,St shooting 48th ST chinhit,bengali
0,ben_0579.wav,regular Prachin Samrat Ashok,bengali
0,ben_0580.wav,Ek khane Dekhun kiefer per Kshetra coronavirus,bengali
0,ben_0581.wav,Madhyamik John Mohan Shilpa,bengali
0,ben_0582.wav,1 month puppy Bangladeshi Bahar na Kudi Bangladeshi,bengali
0,ben_0583.wav,80 wishes of the Boro Masjid,bengali
0,ben_0584.wav,internet Vishay computer network,bengali
0,ben_0585.wav,Coolie Shankar Bangla BESCOM,bengali
0,ben_0586.wav,authored anything TV NET television,bengali
0,ben_0587.wav,shop at home with Orissa Lok Ali,bengali
0,ben_0588.wav,Ekti Bhul to the Jonno Ami Dukhi to,bengali
0,ben_0589.wav,Rohit Ekti jatiyo Sadharan Congress,bengali
0,ben_0590.wav,ichcha Tower of London Vishesh book,bengali
0,ben_0591.wav,not attend college Bangladeshi sister college,bengali
0,ben_0592.wav,Shinchan ka bhoot asali 1815 also,bengali
0,ben_0593.wav,4 xt2 Hindu,bengali
0,ben_0594.wav,Ti Ne Bharat mahadesh Mughal Samrajya Pratishthan Samrat,bengali
0,ben_0595.wav,Prothom Alo Sadharan circuit board,bengali
0,ben_0596.wav,Bangla Wikipedia tritiya nirbachito nibandh,bengali
0,ben_0597.wav,Chhoti asvary Wikimedia commons TicketNew,bengali
0,ben_0598.wav,Jamun computer network public Telephone Network radio network about television network,bengali
0,ben_0599.wav,Purvi kushtia Nadia Zilla Paschim onthibettu Chilam,bengali
0,ben_0600.wav,party nibandh Marne ko Suvidha,bengali
0,ben_0601.wav,tablet Ki bhabe toiri Kore Ami ki tatoo Ke Paar Paar Le Jana ban,bengali
0,ben_0602.wav,Kanoon Eid mahakaushal proper shatak bhabhi Bojhena,bengali
0,ben_0603.wav,Tik Tik padatha big Ganesh HD,bengali
0,ben_0604.wav,ki Jani Dekha jata hai na,bengali
0,ben_0605.wav,authored by Bahar Khadi Jane Austen quotes,bengali
0,ben_0606.wav,Pushpak Aarush Jaat ID locator song,bengali
0,ben_0607.wav,Chintu ki shooting foreign Dhaka Vishwavidyalay Kolkata college,bengali
0,ben_0608.wav,Kintu Pita shopping Japani school,bengali
0,ben_0609.wav,Ami auto show it to read properties,bengali
0,ben_0610.wav,Ruturaj Jo Hona Goli deep got it,bengali
0,ben_0611.wav,show me about Sri Satya,bengali
0,ben_0612.wav,a t o acting angreji boy wear in bath,bengali
0,ben_0613.wav,now ka jila Pran Kendra avasthit School,bengali
0,ben_0614.wav,Ashok alamode daba football cricket tennis owner,bengali
0,ben_0615.wav,juthe photo chilo,bengali
0,ben_0616.wav,Shisha boy Vishwavidyalay passport photo,bengali
0,ben_0617.wav,Bangladeshi Pradhan Nodi,bengali
0,ben_0618.wav,Mohammed Jafar Iqbal rochito actor jonoprio Kishor upanyas,bengali
0,ben_0619.wav,avnijesh coronavirus,bengali
0,ben_0620.wav,Bangladeshi Rajdhani Dhaka 280 short para medical college,bengali
0,ben_0621.wav,bolo to Ek Gulo chhilo British upnivesh,bengali
0,ben_0622.wav,protiti holiday Patta board proposed,bengali
0,ben_0623.wav,Pakistani Sarkari Bhasha angreji AVN datiya Bhasha Urdu,bengali
0,ben_0624.wav,Bangla Academy weekend vishwakosh Prothom kondo,bengali
0,ben_0625.wav,Apna Churu koda En Jeevan Jyoti Patrika prabandhan,bengali
0,ben_0626.wav,Pradeep bhai apna kxt Mel korechi,bengali
0,ben_0627.wav,onto to football Fortune do coding na,bengali
0,ben_0628.wav,Apna Chobi Gulo Kotha ke Kaniya Shweta Fortuner,bengali
0,ben_0629.wav,natok shopno Kolhapur to begin begin Vishesh Agra,bengali
0,ben_0630.wav,Canada after enough ok kudrati hongi Rakha song now,bengali
0,ben_0631.wav,Chamatkar cars with AVN Kshetra,bengali
0,ben_0632.wav,Prothom Patai showing no Osho,bengali
0,ben_0633.wav,London shopping in Prothom part 2 Prakash Bhati,bengali
0,ben_0634.wav,Tai ko 9 Shabd babohar Kora Jayate,bengali
0,ben_0635.wav,Pustak nibandh OTP Sohit Minar Dhaka,bengali
0,ben_0636.wav,bolo marches don't know,bengali
0,ben_0637.wav,irukum kalakarulu thermally whittaker,bengali
0,ben_0638.wav,dekhla shetr Bhul chilo,bengali
0,ben_0639.wav,shopping to Bharati Bangla chalachitra,bengali
0,ben_0640.wav,London Shahar Jhukta Rajya Rajdhani 80 England,bengali
0,ben_0641.wav,Apna ki model aur top,bengali
0,ben_0642.wav,computer Shivaji Talkies Chhota Kudi Canada ka hai,bengali
0,ben_0643.wav,Nobel puraskar Bijoy marking arthaniti bit,bengali
0,ben_0644.wav,eppudu ET authentic to doll on Sonia Satya,bengali
0,ben_0645.wav,Madhu Jaoge is Naam chilo Paras show,bengali
0,ben_0646.wav,Thakor na picture Qatar Sadharan toffee,bengali
0,ben_0647.wav,Uttar America Desh Mexico Rajdhani,bengali
0,ben_0648.wav,topping dukher Sathe bolchi Ami thakte parbo na,bengali
0,ben_0649.wav,Dan Brown rochito Ekti jonoprio Upar Nache,bengali
0,ben_0650.wav,Pradhan Jeevika Krishi Kaaj,bengali
0,ben_0651.wav,Tu Khoon Bangladesh kilo Pakistani Pradesh,bengali
0,ben_0652.wav,Pakistani Pataka Bishnoi Pakistan shot Karan website,bengali
0,ben_0653.wav,Shikha Nahin pradeshik Shiksha AVN for robotic I Shikhar shuru,bengali
0,ben_0654.wav,Ashapuri Army baccha deta parchi,bengali
0,ben_0655.wav,Kanch quality Holi ki Kote haway,bengali
0,ben_0656.wav,hirakund Khetri uploadkadeh.ir ka Chobi apni Saraswati,bengali
0,ben_0657.wav,Vivo Chhod Dhaka Vishwavidyalaya Dhaka holiday Ramkaran shahidullah hall,bengali
0,ben_0658.wav,action movie 80 Bangladeshi singer,bengali
0,ben_0659.wav,we can only for this phone utha Pradhan Bhagwan,bengali
0,ben_0660.wav,Muli corner gobeshona Itihaas 8862 aavishkar,bengali
0,ben_0661.wav,itiadoh fini actual shop Mall Senapati pratishthit,bengali
0,ben_0662.wav,Bing Shatabdi ke samast,bengali
0,ben_0663.wav,Army voter ID code,bengali
0,ben_0664.wav,100 30 Dhara Dhara,bengali
0,ben_0665.wav,Dukhi to fule Ala paatar paatar there,bengali
0,ben_0666.wav,Kichu sampadan,bengali
0,ben_0667.wav,Ireland Dipesh Uttar Purva prant Uttar Ireland on 17 August,bengali
0,ben_0668.wav,Aahat Apna Kehte Jodi sametha Ke aapane Niche khane actor tutorial likhe chalena order,bengali
0,ben_0669.wav,it is got home hu Aakruti taking ke Namdev kolshi Woodward,bengali
0,ben_0670.wav,Khurja acche dating Mona School Cadet College for WhatsApp,bengali
0,ben_0671.wav,Aage I want to change the policy,bengali
0,ben_0672.wav,kahan likha hua hu mai Hindu I,bengali
0,ben_0673.wav,Khoon Pani Ki Kichu Golpo,bengali
0,ben_0674.wav,Khulna opposite o x 3 ODI,bengali
0,ben_0675.wav,Newton Holo Bollywood,bengali
0,ben_0676.wav,photographs of opposite ITI Sarkari Medical College,bengali
0,ben_0677.wav,O Bangla bhasha Prothom Bodo,bengali
0,ben_0678.wav,Pal Rajvansh O Prachin Bangla both Dharma kolambi Rajvansh,bengali
0,ben_0679.wav,room Sham Raja Senapati Pratham Samrat,bengali
0,ben_0680.wav,queen of Upar July rain AVN Shadow Kshetra 2,bengali
0,ben_0681.wav,bahut chhatron Aahat O AVN vistar hai,bengali
0,ben_0682.wav,beta jyotirvigyan Pratishtha ka Vigyan the,bengali
0,ben_0683.wav,Kishor Barshi muktijoddha Osho grahan Karen AVN Dhaka Jila,bengali
0,ben_0684.wav,Baba Kotha Vishesh Putra Vito padam,bengali
0,ben_0685.wav,Kota ki muchhe Dewas,bengali
0,ben_0686.wav,aap Bondhu Re jomba Kshetra name,bengali
0,ben_0687.wav,Khub Sundar,bengali
0,ben_0688.wav,Taj mrittur shortest transport Jo Itihaas Kichu provision,bengali
0,ben_0689.wav,beauty nibandh hi a template korechi Ami,bengali
0,ben_0690.wav,Sudhu Jo Kochi foreign schedule,bengali
0,ben_0691.wav,ji Kyon Koi Di cost,bengali
0,ben_0692.wav,Naam haway shokti sancharan,bengali
0,ben_0693.wav,Assalam to above 200,bengali
0,ben_0694.wav,a Swasthya Bangladeshi mrutyu,bengali
0,ben_0695.wav,a quote Guru Dekho AVN sister,bengali
0,ben_0696.wav,pure Puri Road Kora jabe na,bengali
0,ben_0697.wav,Jeevan Jyoti Naam asali Bangladeshi share bazar Hawa uchit chilo,bengali
0,ben_0698.wav,Mouni Roy do it nibandh Rakha uchit,bengali
0,ben_0699.wav,plated Assalam chalo East Bengal Club,bengali
0,ben_0700.wav,Tara bolen Khush Holo Gotan AVN Ek ok,bengali
0,ben_0701.wav,totoodo spotted Thodi right that he should be put on person do,bengali
0,ben_0702.wav,Parichay Banakar dikha Tu Chitra still p.m.,bengali
0,ben_0703.wav,Bharti Paschim ticket ek taraju,bengali
0,ben_0704.wav,Neend notice boy Aana calamity Hote,bengali
0,ben_0705.wav,Taher poornam Mirza Mohammed Ali,bengali
0,ben_0706.wav,Chaho army is don't know about dukkho Prakash coaching,bengali
0,ben_0707.wav,Rabindranath Thakur rochito Ekti Choto Upar Nache,bengali
0,ben_0708.wav,Bangladesh Medical College Datia Prothom Sarkari Medical College,bengali
0,ben_0709.wav,Nari Andolan is both a Rajniti Pravesh,bengali
0,ben_0710.wav,padarth Vigyan Nobel puraskar Nobel Foundation is official website,bengali
0,ben_0711.wav,is Juno Samadhan Hero,bengali
0,ben_0712.wav,Rakhi Bhai Ki to nibandh Kintu Samosa Hote Naam Ni,bengali
0,ben_0713.wav,Bangladeshi utpadak utkrusht dhaan,bengali
0,ben_0714.wav,ganit Peeth beginning 6 ganit AVN big and fresh whole Vibhag over the Russian,bengali
0,ben_0715.wav,Wikipedia shop procoal face shop nibandh a bomb Chobi copyright free,bengali
0,ben_0716.wav,jhope taking Islam it through Itihaas,bengali
0,ben_0717.wav,tamatar aur ek porichoy uthata Vishwavidyalay Rasayan Vibhag Amazon Practo,bengali
0,ben_0718.wav,Vishwas anyhow Poche ka bani thi Mala,bengali
0,ben_0719.wav,kivabe korbo parchina,bengali
0,ben_0720.wav,Kolkata 60 Bharat Paschim Banga Rajya Jila,bengali
0,ben_0721.wav,parukutty songs Arjun Thakor,bengali
0,ben_0722.wav,airport Sahitya ki anuvad Natok likhen,bengali
0,ben_0723.wav,ITI Board Tu Mane Sudhu matro cricket Mati se Bane bag,bengali
0,ben_0724.wav,Jamun Paris Litchi,bengali
0,ben_0725.wav,Shiva Sath Chod Dela Kila,bengali
0,ben_0726.wav,Body Shop,bengali
0,ben_0727.wav,apni Kanu recording Sthan teeshopper ke exhibition lekhak ka uchit,bengali
0,ben_0728.wav,Bangladeshi Sathi Nanda Kishore muktijoddha AVN Rohit,bengali
0,ben_0729.wav,Kintu Prithvi it is polymer com,bengali
0,ben_0730.wav,we keep our wooden cook shimano,bengali
0,ben_0731.wav,Eid Kichu bole to show niche Diya Holo,bengali
0,ben_0732.wav,Kabul district Rajdhani,bengali
0,ben_0733.wav,Dukh kato Prothom bar Kotha bujhte Pari,bengali
0,ben_0734.wav,abe Vishwavidyalay bortoman Upar Chadh Jo aur dhap of s,bengali
0,ben_0735.wav,Khulna shop opposite ITI college,bengali
0,ben_0736.wav,Paschim Bangal ka Lekha nibandh or Sampoorna,bengali
0,ben_0737.wav,Asia PTV sabse Boro foreshocks adorable mahadesh,bengali
0,ben_0738.wav,Sona ft dhaatu aur adhatu,bengali
0,ben_0739.wav,mukto Bangla font profile photo Bangla Lekha pradarshani Jonno chai Bangla font,bengali
0,ben_0740.wav,vishwakosh likha Nahin Hai best Vashi,bengali
0,ben_0741.wav,Ami apnake Mel korechi Ami,bengali
0,ben_0742.wav,Tai Dakshin Gulo ke Dakshin Kota coaching,bengali
0,ben_0743.wav,Holi old song Kamothe shop KBC Jor,bengali
