,Filename,text,language
0,269951_HeavensRevenge-20110529-ibo_de11-010.wav,underwater inhalation for combiflam dose,German
0,272950_HeavensRevenge-20110528-fum_de4-06.wav,only internet on the name factors and the Bayan,German
0,274589_AndreyBarrientosCostaRica-20130710-lud_de10-150.wav,the address must to integer by legal field and given,German
0,274640_DanielNeuhaus-20080303-cxf_de2-37.wav,Tippu campal star Divas ke nuskhe,German
0,274960_HeavensRevenge-20110529-lvg_de9-149.wav,open Sea on the Einstein Swai Swai zaxxon,German
0,276733_BRwgt-20140228-vcp_de8-057.wav,teman I Naina full song Hansa thi,German
0,277102_DanielNeuhaus-20080303-jzi_de4-69.wav,we can The tile market from console and interest rate,German
0,278150_HeavensRevenge-20110528-tte_de11-132.wav,SSN establishes an event with the option of 30th Road,German
0,278476_HeavensRevenge-20110529-klu_de7-072.wav,iron is known as most fans here I am Mafia,German
0,279082_HeavensRevenge-20110528-fum_de4-05.wav,Piranha office Ludhiana,German
0,279780_HeavensRevenge-20110529-gbj_de9-141.wav,Aaj Subah crime so but a tiger story,German
0,280310_HeavensRevenge-20110528-baj_de3-39.wav,Sone nadi tapman,German
0,282735_BRwgt-20140723-trd_de11-010.wav,for compiling doors,German
0,Error,Error,Error
0,285870_GeorgSimmel-20140421-ptj_de4-84.wav,before he jivali ke mathematician,German
0,286578_DirkSchnelleWalka-20140703-lys_de5-105.wav,Aisa kaun sa missile enquiries are given,German
0,288178_1337ad-20170321-hii_de9-149.wav,Einstein's him quite phisics UN,German
0,289343_BRwgt-20140718-ynj_de4-19.wav,u Pi match dikhayen,German
0,289708_DanielNeuhaus-20080303-zpn_de5-117.wav,Street hypnosis shoot Sohel please contact importance,German
0,290493_Black_Galaxy-20080530-xzb_de11-104.wav,tasvir ka Qubool Hai start 4 ank,German
0,292938_1337ad-20170321-qbd_de3-03.wav,when you're finished with Tata Sky no convert fencing,German
0,293027_1337ad-20170321-ntd_de11-141.wav,another word for white and craft,German
0,294384_BRwgt-20140228-vcp_de8-050.wav,Mitti muhurtha Naal function hairstyle of Mist for busy and heart,German
0,295320_HeavensRevenge-20110528-qbe_de10-010.wav,list of temperature of Susan,German
0,296640_AndreyBarrientosCostaRica-20130709-cjw_de11-025.wav,Mitra Wale Hath system glass facade technique,German
0,Error,Error,Error
0,297218_HeavensRevenge-20110529-lge_de11-037.wav,whimsically account board mein time Fast and Furious that level Samsung oven,German
0,298323_DirkSchnelleWalka-20140703-eyz_de8-007.wav,is it definitely a winner Pacific with the turks,German
0,302041_DanielNeuhaus-20080303-jla_de5-127.wav,Hath Ke Aage Ki news,German
0,302149_HeavensRevenge-20110529-lid_de7-031.wav,back One Direction fake or real contact murder cases of process face,German
0,302800_DanielNeuhaus-20080303-cxf_de2-33.wav,ya to Fir 2009 is computer of stock cloth,German
0,304560_HeavensRevenge-20110529-ujo_de2-14.wav,Ice skaters and their staff at most,German
0,305068_BRwgt-20140723-trd_de11-012.wav,please sign in for a pink lipstick in 10 Telugu,German
0,305256_AndreyBarrientosCostaRica-20130720-pyu_de10-007.wav,women and in article also came bill,German
0,305520_1337ad-20170321-amr_de4-76.wav,Sanjay mathematic having a need for an experiment in UP,German
0,306227_BRwgt-20140228-msx_de8-135.wav,Indian festivals function Masti zyluli for sauvignon,German
0,306655_HeavensRevenge-20110529-nhk_de9-168.wav,Anant question that soon computer talentnext and brother,German
0,309383_AndreyBarrientosCostaRica-20130709-cjw_de11-029.wav,Bhagwat shaadi it's why would the shit about me,German
0,309783_AdrianTovar-20080727-gov_de2-27.wav,Lal Chauhan 95,German
0,310449_1337ad-20170321-bej_de6-50.wav,Tum Bewafa Ja hun,German
0,311541_1337ad-20170321-ufl_de3-39.wav,John donne on guitar in Bangalore,German
0,312286_BRwgt-20140228-msx_de8-142.wav,Kichad na comment for consistent-return,German
0,313121_HeavensRevenge-20110529-wfp_de2-08.wav,the system would risk faced aunt w b 36,German
0,313759_HeavensRevenge-20110528-ahk_de10-093.wav,the time ka hai man slow Savera guitar for yourself,German
0,314071_Crazo-20091014-rfm_de7-006.wav,bi f*** Zubair cute National computer officers between East India,German
0,314697_DirkSchnelleWalka-20140703-eyz_de8-006.wav,tied to this contribution Sheeran Andhra ke register,German
0,315353_AndreyBarrientosCostaRica-20130710-lud_de10-154.wav,does any getting a signal stack is invite ibuzen ansune min,German
0,318652_BRwgt-20140228-qlo_de8-093.wav,your picture in the wind is conservation,German
0,318665_AndreyBarrientosCostaRica-20130710-lud_de10-157.wav,S stylish sticker Yuva I am caused by internet 7,German
0,319559_Defense-20090727-wlz_de5-086.wav,Norway and Finland on Fossil and,German
0,321294_HeavensRevenge-20110528-wng_de3-44.wav,of these was a given month by icons for fake likes,German
0,321419_Black_Galaxy-20080530-xzb_de11-096.wav,Sankalp system with integrated system and analysis on wind power,German
0,321598_HeavensRevenge-20110529-gbj_de9-139.wav,when we in an investment business,German
0,323083_HeavensRevenge-20110529-lid_de7-030.wav,another Loki looking for farmers next protiprot S face white house ko phone,German
0,324807_GeorgSimmel-20140421-wyw_de3-69.wav,bhakti geet,German
0,325149_BRwgt-20140228-bgs_de8-031.wav,t-34 Namak inviting for bandwidth yaden,German
0,326538_HeavensRevenge-20110528-mqt_de5-111.wav,check offer track is entry sahejna synbiotic aanjana,German
0,328986_DanielNeuhaus-20080303-cxf_de2-35.wav,tall guy on walking style,German
0,329398_1337ad-20170321-urq_de11-019.wav,bus is menswear hooter turn on Tashi liye prayog it happen,German
0,329649_1337ad-20170321-vyr_de3-59.wav,and telephone and Rosewood in left side,German
0,330079_HeavensRevenge-20110529-llt_de7-091.wav,information on an ever increasing had to stand dispersion coronavirus farm grahan,German
0,333617_BRwgt-20140228-zpn_de11-020.wav,Teachers photo call amrut g Sandhu thing owners lifan,German
0,333888_HeavensRevenge-20110528-ahk_de10-095.wav,after startup of timber cream find the quorum,German
0,334523_HeavensRevenge-20110529-ghq_de11-144.wav,just craft that can be fired staff,German
0,335765_HeavensRevenge-20110528-wng_HeavensRevenge-20110528-wng_de3-41.wav,hereby busted and EMF of a closed tufan,German
0,336878_AndreyBarrientosCostaRica-20130710-lud_de10-155.wav,discharge with chinati ghost Middle East and sulphur that,German
0,339525_HeavensRevenge-20110528-woz_HeavensRevenge-20110528-woz_de9-141.wav,school students but a sex stories in the museum,German
0,340566_Crokoking-20110119-dbi_de10-153.wav,ichchadhari Nagin Nache taka,German
0,341343_AndreyBarrientosCostaRica-20130710-hct_de5-055.wav,visitor Visa form for straighten Din and M shoots,German
0,342609_BRwgt-20140228-qlo_de8-100.wav,TIFR life and sliced up with mechanical and fat side America list,German
0,342732_BRwgt-20140228-bgs_de8-026.wav,yah bike and enforced in 1830 for wireless LAN real is your,German
0,343388_1337ad-20170321-czb_de11-101.wav,webenza FIR correct voter id card in Bihar,German
0,344875_HeavensRevenge-20110529-byr_de4-48.wav,I'm going that so I take inside campus kinds of organisation,German
0,345377_HeavensRevenge-20110529-mdg_de8-031.wav,telephone no Makhan by the help of onion,German
0,347803_HeavensRevenge-20110528-tte_de11-126.wav,Tera Ramayan Hai today English grammar forum,German
0,347857_1337ad-20170321-ntd_de11-137.wav,Fahad Shah Faisal and moon up at hagen,German
0,348404_AndreyBarrientosCostaRica-20130709-cjw_de11-028.wav,afunika B ho mil parson 20 to 26 method at Kabil,German
0,349564_Crokoking-20110119-dbi_de10-156.wav,Yonex ke rate of farmers market,German
0,350540_DanielNeuhaus-20080303-zpn_de5-123.wav,yah to man respect,German
0,350958_AdrianTovar-20080727-gov_de2-28.wav,undecided festivals ki 5 Paisa give,German
0,350979_de11-069.wav,understand the Forgotten but having capacity it can sue co-ordinate Bayan,German
0,351788_HeavensRevenge-20110528-ezs_de3-15.wav,toy trust reflector and Shine Nagpur from staff,German
0,352359_HeavensRevenge-20110528-ory_de4-10.wav,how your greatest countries are the following next next player,German
0,354741_HeavensRevenge-20110528-mqt_de5-105.wav,traffic rule for Mr damper for Visa Habib,German
0,355085_1337ad-20170321-yqy_de10-054.wav,staff and living suffered to meditate,German
0,355596_AndreyBarrientosCostaRica-20130710-hct_de5-060.wav,doctor ke pass usko form 68,German
0,356084_GeorgSimmel-20140421-wyw_de3-67.wav,Thiruthani Baitha product,German
0,356617_AdrianTovar-20080727-paz_de3-20.wav,the state should select the normal size of Inland executable seat,German
0,356909_BRwgt-20140718-oxg_de8-075.wav,PF the internet IP address,German
0,358052_HeavensRevenge-20110529-lvg_de9-146.wav,the cost of cameras on speaker connectors at Swayam,German
0,360247_HeavensRevenge-20110529-lge_de11-042.wav,Twister slides 2013,German
0,360837_BRwgt-20140723-idz_de3-67.wav,Siddharth,German
0,362091_BRwgt-20140228-yvz_de8-060.wav,soda while a computer scientific,German
0,364229_AndreyBarrientosCostaRica-20130709-cjw_de11-031.wav,bahut Josh and sabotaged to visit their families in Seoul,German
0,366526_1337ad-20170321-yqy_de10-051.wav,the sangapur display function year,German
0,367256_Crazo-20091014-rfm_de7-009.wav,tablets for what exactly videos,German
0,367370_AdrianTovar-20080727-xjh_de11-146.wav,the present status define in Hindi thought on standard and extinct,German
0,370629_GeorgSimmel-20140421-cgr_de7-057.wav,economics 8 b b has its own it was itself and lost,German
0,373023_1337ad-20170321-ntd_de11-144.wav,the fight with industry of that and if I had to offer,German
0,374587_HeavensRevenge-20110529-klu_de7-069.wav,what are the best way out screenshot,German
0,375389_AdrianTovar-20080727-iif_de10-134.wav,thile why is a food chain in the product Chinese hair stylist and under,German
0,375609_HeavensRevenge-20110529-kux_de10-073.wav,methods of software Khan Suna Krishna parcel service,German
0,377739_AnnaKarpekewitsch-20091129-jbu_de9-033.wav,private server can Email integration of AC given to Hassan,German
0,378022_Black_Galaxy-20080530-xzb_de11-099.wav,if you can this circuit is going to Z Square,German
0,378814_HeavensRevenge-20110529-nhk_de9-166.wav,in ethereum is digital watch in cans or not,German
0,378964_Defense-20090727-wlz_de5-091.wav,this land is time wonder girl their thirties,German
0,381641_BRwgt-20140228-vcp_de8-054.wav,beauty inside if in that,German
0,387562_1337ad-20170321-ntd_de11-139.wav,David Cook come with an advocate of a biscoff brn,German
0,387597_1337ad-20170321-kgs_de11-036.wav,Evelyn sakhiyon working you when you are under a own up to game,German
0,392461_GeorgSimmel-20140421-fdc_GeorgSimmel-20140421-fdc_de5-076.wav,owner fasal Gin alcohol associate modern list,German
0,392540_1337ad-20170321-blf_de9-161.wav,Ashwin off,German
0,395280_HeavensRevenge-20110528-bno_de6-13.wav,sweater border design to make it right sinciput hafted,German
0,396509_BRwgt-20140228-ewk_de8-071.wav,height of the booth on the Titan Season 2,German
0,397079_FrankJger-20111114-zmx_de5-041.wav,inherit Rai height from my height of tables,German
0,397440_HeavensRevenge-20110529-ibo_de11-013.wav,Android apps back Khan,German
0,398005_DanielNeuhaus-20080303-jla_de5-128.wav,2018 Tum Andhra open,German
0,398228_HeavensRevenge-20110529-nhk_de9-170.wav,fun things we stick to comment,German
0,400380_HeavensRevenge-20110528-ezs_HeavensRevenge-20110528-ezs_de3-10.wav,craters and meaningful and took SummerSlam Dhaam,German
0,400809_1337ad-20170321-urq_de11-021.wav,assistant course in net vehicle there kutta,German
0,400947_HeavensRevenge-20110529-ujo_de2-10.wav,top 10 shoes women Twinkle Khan,German
0,401131_DirkSchnelleWalka-20101217-swz_de7-079.wav,didi ki Thal mobile phone ki baat kar rahe the lokgeet,German
0,404143_HeavensRevenge-20110529-rju_de9-045.wav,confidence once with all of your b,German
0,404375_BRwgt-20140228-qlo_de8-097.wav,310 divyakant site owner craft by thought,German
0,404654_HeavensRevenge-20110529-rju_de9-040.wav,kids poem,German
0,406426_HeavensRevenge-20110529-tng_de8-113.wav,saisangeet in groups in inspired gang,German
0,407011_GeorgSimmel-20140421-wyw_de4-03.wav,Kusha Kapila ke phone peach Veeram Padam block first test list,German
0,407127_FrankJger-20111114-zmx_de5-043.wav,open and,German
0,407428_AndreyBarrientosCostaRica-20130710-lud_de10-153.wav,tikeshwar discard you Baat unhen for their Aashiq Nache take up,German
0,408564_AdrianTovar-20080727-gov_de2-26.wav,Vikram species Krrish ki Zain change not allowed,German
0,408765_HeavensRevenge-20110528-ahk_de10-099.wav,Pizza Chalisa with lyrics Alisha 96 my father and mother,German
0,411194_HeavensRevenge-20110528-fum_de4-04.wav,Unix machine using tapping,German
0,411512_1337ad-20170321-vzg_de9-062.wav,7853 Vatan,German
0,414609_AndreyBarrientosCostaRica-20130720-pyu_de10-006.wav,please been is this problem in babies in word,German
0,415591_BRwgt-20140718-hof_de9-170.wav,impact not not defined the sticker documentum,German
0,416142_HeavensRevenge-20110528-qbe_de10-017.wav,Dekho men Tata Hexa price in formula in with Garden,German
0,416483_AndreyBarrientosCostaRica-20130720-pyu_de10-005.wav,zoned and how was never in them build,German
0,417592_1337ad-20170321-vzg_de9-057.wav,computer not perfect,German
0,418667_HeavensRevenge-20110528-ahk_de10-094.wav,Samsung air conditioner but ful form the sweaters first time,German
0,419581_GeorgSimmel-20140421-zvj_de8-053.wav,the computer consists of opinion,German
0,419891_HeavensRevenge-20110528-woz_de9-142.wav,papers on off we are following is the currency network as a,German
0,419931_GeorgSimmel-20140421-fdc_de5-081.wav,Athar Aamir Khan latest pics,German
0,420205_DirkSchnelleWalka-20140703-lys_de5-103.wav,the sweetness of lighting fixtures design,German
0,420722_Black_Galaxy-20080530-xzb_de11-100.wav,Krishna medicine at least the first mission passed away,German
0,422056_BRwgt-20140718-hof_de9-173.wav,I need for sending an investigative journalist is problem lose musically,German
0,422498_1337ad-20170321-hii_de9-147.wav,balance better telephone number swine fever year and its bye,German
0,424442_DirkSchnelleWalka-20140703-eyz_de8-003.wav,auto Kasi Chakki not reflect back to the iPhone,German
0,426263_AdrianTovar-20080727-bxq_de11-068.wav,the address Prakash staff lyric list prices function notes,German
0,426864_HeavensRevenge-20110529-lid_de7-033.wav,popular alarm technician grade 2,German
0,427329_BRwgt-20140718-hof_de9-171.wav,is a to comment have a Ishq E Nabi Ki tarikh Ka Manga photography,German
0,Error,Error,Error
0,430792_Defense-20090727-wlz_de5-084.wav,topper kaise ho kaun ho gana uska Aaj,German
0,430961_HeavensRevenge-20110529-rju_HeavensRevenge-20110529-rju_de9-038.wav,thirunama 17 Subah is on speed internet and b and believed,German
0,432516_1337ad-20170321-qbd_de2-38.wav,I am on the sofa,German
0,432736_BRwgt-20140228-yvz_de8-058.wav,Hero computer internet admin distance I ne IP address,German
0,432803_HeavensRevenge-20110529-wfp_de2-10.wav,first intrusion Mann film Aamir Khan,German
0,433814_FrankJger-20111114-zmx_FrankJger-20111114-zmx_de5-038.wav,Sushant Singh,German
0,435513_BRwgt-20140723-idz_de3-69.wav,guitar tuning Indian father,German
0,435747_HeavensRevenge-20110529-nhk_de9-165.wav,used its blood pressure was an unhandled polity,German
0,436481_HeavensRevenge-20110528-woz_de9-146.wav,because you can understand that's near me,German
0,437023_1337ad-20170321-qbd_de2-36.wav,definition of an industry that and water to air in can,German
0,438687_HeavensRevenge-20110529-wfp_de2-13.wav,infant phone hand UPS tracking,German
0,439908_BRwgt-20140228-msx_de8-138.wav,cynosure of an iron metal bed with son,German
0,440751_1337ad-20170321-urq_de11-020.wav,use of protocol and nutrition who think on his life,German
0,441143_1337ad-20170321-ufl_de3-37.wav,heartbeat in BPS and game,German
0,441384_AndreyBarrientosCostaRica-20130710-hct_de5-054.wav,horse dance by S I never steam to form two sets for this event sign,German
0,Error,Error,Error
0,442961_1337ad-20170321-amr_de4-69.wav,marketing consultant,German
0,443624_GeorgSimmel-20140421-wyw_de3-70.wav,kya infinite Shaitani Hai Kisne likha town out Super figure,German
0,444248_HeavensRevenge-20110528-fum_de4-08.wav,is home facilities along with you please advise you that I love you can between the characteristic of your,German
0,445114_1337ad-20170321-amr_de4-73.wav,mathematics of August along the version of the physical 10 revision trapped,German
0,446682_HeavensRevenge-20110529-mdg_de8-037.wav,Optima steamer Wiki,German
0,448956_HeavensRevenge-20110528-ezs_de3-19.wav,pure silicone strap customer Mein gift,German
0,449556_HeavensRevenge-20110529-lge_de11-034.wav,some creative prints on it since I have missed the world,German
0,449723_HeavensRevenge-20110528-wng_de3-50.wav,episoft intuitive and go away after great a seamless using xylene,German
0,450595_BRwgt-20140228-zpn_de11-022.wav,pursuit of final of an instant pot,German
0,450760_AnnaKarpekewitsch-20091129-jbu_de9-031.wav,IP addressing can interrupt eminent,German
0,452365_AdrianTovar-20080727-gov_de2-25.wav,why halt and alter system iron feels it can Pakistan then hostel,German
0,453983_1337ad-20170321-kgs_de11-041.wav,tough to get short and distance to form fillup for,German
0,456211_AdrianTovar-20080727-paz_de3-21.wav,in concrete for Hata theatre and Iceland Jesus Christ quotes and its,German
0,457775_BRwgt-20140228-kwo_de8-119.wav,3 Sal to Indian thungon Stalin,German
0,460115_HeavensRevenge-20110529-nhk_de9-172.wav,the document not present running MI portable or not,German
0,460995_GeorgSimmel-20140421-wyw_de4-02.wav,text b b b Mahananda first visit,German
0,461928_AdrianTovar-20080727-bxq_de11-075.wav,biggest win the sky Twitter kundru khane Hathway,German
0,463905_HeavensRevenge-20110528-baj_de3-37.wav,Siddharth Malhotra and BPS army game,German
0,464552_Crazo-20091014-rfm_de7-003.wav,I am going to write class in restful swanson,German
0,465833_DanielNeuhaus-20080303-hfe_de3-58.wav,uninstall the open interest on soft power,German
0,466278_HeavensRevenge-20110528-ory_de4-14.wav,lyrically I need access to change event in his farm,German
0,466314_HeavensRevenge-20110529-lzj_de10-020.wav,Akon phone ki Rahman best white colour where are you,German
0,469482_AndreyBarrientosCostaRica-20130709-cjw_de11-024.wav,this is a technique for the Indian B in where can I get it,German
0,470906_HeavensRevenge-20110529-gbj_de9-140.wav,Tum back to school student doing stunts,German
0,472986_HeavensRevenge-20110528-peo_de10-069.wav,paper kites per gana staff cartoon with this kind inside a play,German
0,473588_ALI-20130113-iyl_de10-022.wav,in my next song hot romantic love,German
0,474810_HeavensRevenge-20110528-tte_de11-131.wav,is software control and becomes website for when they are,German
0,476856_HeavensRevenge-20110529-byr_de4-50.wav,bajheera refers to avoid congestion control stunt wala,German
0,477858_1337ad-20170321-mba_de7-020.wav,office wear dress kurta gives toilet,German
0,478161_AdrianTovar-20080727-paz_de3-25.wav,fish kite phone hu star - can find text solve an illusion art fair,German
0,479728_ALI-20130113-iyl_de10-025.wav,screen Intercity seat Kitni seat available,German
0,481052_ALI-20130113-iyl_de10-021.wav,document of text is employer for before your home,German
0,482340_1337ad-20170321-bej_de6-52.wav,directive and Awesome facts,German
0,482612_HeavensRevenge-20110529-uiz_de11-114.wav,implement IP based on sex offenders in the and Vikram,German
0,482881_BRwgt-20140228-nrb_de11-138.wav,skipped staff visits book and staff common,German
0,484753_HeavensRevenge-20110528-mqt_de5-109.wav,Austin Sharif help was invited 10 no,German
0,484873_DirkSchnelleWalka-20101217-iws_de11-101.wav,West Indies,German
0,Error,Error,Error
0,492080_AdrianTovar-20080727-xjh_de11-143.wav,iska panchasheel is where a form in the sky high Cafe,German
0,492702_BRwgt-20140228-qlo_de8-095.wav,English is your kind of it tell Us Paar Hai,German
0,493357_HeavensRevenge-20110528-fum_de4-03.wav,who is a public are formed with A and B Block Faisal Aslam fast result,German
0,494920_HeavensRevenge-20110529-mlp_HeavensRevenge-20110529-mlp_de11-102.wav,TOEFL exam,German
0,495258_Crazo-20091014-rfm_de7-010.wav,sodium St School palava full form,German
0,496546_HeavensRevenge-20110528-mqt_HeavensRevenge-20110528-mqt_de5-102.wav,take liver kya master and distance non-smoking Anshu Itna k,German
0,497482_HeavensRevenge-20110529-mlp_de11-110.wav,Oppo phone uthana sign and Secure location of your to Allah Hota,German
0,497506_FrankJger-20111114-zmx_de5-046.wav,insights head with test,German
0,497823_HeavensRevenge-20110528-mqt_de5-110.wav,son of coronavirus stop related Bayan,German
0,498081_AdrianTovar-20080727-iif_de10-143.wav,I need starter ship a can of tuna,German
0,498121_HeavensRevenge-20110528-bno_de6-17.wav,the father kitna time zone for building yaakov,German
0,499535_Crazo-20091014-rfm_de7-004.wav,kis office address of Guntur district,German
0,500025_AdrianTovar-20080727-iif_de10-136.wav,Jo Mini 8 months visa ko is Kitni,German
0,501712_1337ad-20170321-vyr_de3-55.wav,skit on the of kasht item item monopolar,German
0,503118_HeavensRevenge-20110528-bno_de6-18.wav,assisting the normal lock and for 30 years old for his penis,German
0,503727_1337ad-20170321-ufl_de3-45.wav,carpet hartron,German
0,507039_HeavensRevenge-20110529-kux_de10-071.wav,adjust fan price for the software,German
0,507760_HeavensRevenge-20110528-ory_de4-13.wav,text message from the item class text from paneer,German
0,511488_1337ad-20170321-ufl_de3-44.wav,what is a was given month why can't power for glass better,German
0,514353_HeavensRevenge-20110528-ahk_de10-092.wav,Amit Honda first loan,German
0,514491_1337ad-20170321-urq_de11-022.wav,in pursuit of an orphanage standard,German
0,515018_1337ad-20170321-amr_de4-75.wav,mathematics khanan at was with contract in angle listen synonym,German
0,517057_AndreyBarrientosCostaRica-20130720-pyu_de10-011.wav,Dehat I need a women dispovan news in Kan,German
0,517268_Crazo-20091014-cey_de11-057.wav,5 x 5 x 6 plus,German
0,Error,Error,Error
0,519786_HeavensRevenge-20110529-wfp_de2-09.wav,it ok tater house I am too much of an h,German
0,Error,Error,Error
0,520768_BRwgt-20140718-hof_de9-177.wav,who killed Ashwin that padathil Kumta thali in Surat,German
0,522326_BRwgt-20140718-ynj_de4-16.wav,magnet Aasan Kone School first muslim,German
0,524026_BRwgt-20140228-nrb_de11-133.wav,and nothing Uske Rishta tha so Thailand Vs Krrish 4,German
0,524444_GeorgSimmel-20140421-ndq_de11-165.wav,Anthony to study must consider in capital sign,German
0,525918_HeavensRevenge-20110528-mqt_de5-106.wav,one touch strips for his Wrestlemania concinna,German
0,525990_GeorgSimmel-20140421-fdc_de5-078.wav,important weltkrieg differentiation toys lunch Flipkart online,German
0,526365_BRwgt-20140228-bgs_de8-030.wav,Tesla of integers freshwater and far from the Indus river Norman,German
0,526733_HeavensRevenge-20110528-ezs_de3-13.wav,Siddharth Colaba inland for grahan,German
0,527169_HeavensRevenge-20110529-klu_de7-070.wav,system pure gane suits more than 3 hours reception,German
0,527189_DirkSchnelleWalka-20090901-ajk_de10-045.wav,an eventual of Triphala covid-19,German
0,532418_AdrianTovar-20080727-iif_de10-141.wav,Bikaner is on in Panipat nets back anytime visit Swayam,German
0,532483_1337ad-20170321-urq_de11-023.wav,just Baat Sabko Pata are 2000 communica transmitted,German
0,534178_1337ad-20170321-czb_de11-102.wav,within book some,German
0,534815_HeavensRevenge-20110529-ibo_de11-008.wav,Dept of members and directors International,German
0,535431_BRwgt-20140228-zpn_de11-026.wav,I thought I'd have to have a stealth,German
0,536168_GeorgSimmel-20140421-ndq_de11-166.wav,symbols of teacher in caustic soda instead we are in,German
0,537269_HeavensRevenge-20110528-mqt_de5-104.wav,techwiser falling from the sky,German
0,538887_HeavensRevenge-20110529-tng_HeavensRevenge-20110529-tng_de8-111.wav,Stark hit song Khan Swayam follows function Mein Metal Fusion,German
0,539669_Defense-20090727-wmu_de7-049.wav,interesting going to school Christ is beside side lying at side LED,German
0,540291_HeavensRevenge-20110528-fum_de4-11.wav,tasvir and Johnson that one process for Visa,German
0,540655_HeavensRevenge-20110529-lvg_de9-147.wav,pensy Patari Telephone by vier and stripes 5,German
0,544047_de11-065.wav,internet and B of preventing squid effect as transparent proxy,German
0,546210_1337ad-20170321-blf_de9-160.wav,total expenditure of the unity Atif and schooling of maximum marks Quora,German
0,546239_HeavensRevenge-20110528-tte_de11-127.wav,owner free notes on the software and give your to Fallen,German
0,547103_Crazo-20091014-cey_de11-051.wav,decipher great for one signal,German
0,548107_DirkSchnelleWalka-20101217-swz_de7-082.wav,gift card request limit fritzl jaati Hoon Chandan,German
0,548129_1337ad-20170321-hii_de9-148.wav,Surat Cinema by Siya and,German
0,548717_HeavensRevenge-20110529-mdg_de8-036.wav,man Khan Main To Mehandi for telephone,German
0,549658_1337ad-20170321-blf_de9-166.wav,nithari sector 31 comes under,German
0,549777_GeorgSimmel-20140421-cgr_de7-058.wav,treatment of holy spirit in Khan,German
0,554790_HeavensRevenge-20110529-rju_de9-041.wav,purana gana fashion fan 52,German
0,556055_HeavensRevenge-20110528-peo_de10-075.wav,PS2 value on stem September monsoon on suggestion,German
0,556528_BRwgt-20140718-ynj_de4-20.wav,kimat Ki Roti person for fashion Se gane with cutting condom,German
0,557571_HeavensRevenge-20110528-rms_de10-028.wav,tilai Suman website for venomous interpretation,German
0,558989_DirkSchnelleWalka-20101217-swz_de7-083.wav,used under the Mahi pm of Thailand,German
