,Filename,text,language
0,000815_HeavensRevenge-20110528-qbe_de10-016.wav,simple and fork in an from the block and hyperlink and,German
0,001700_GeorgSimmel-20140421-ndq_de11-167.wav,nashta financed Yogi woulda fitting used to control volume,German
0,001900_AdrianTovar-20080727-bxq_de11-074.wav,Japan try principal with sharing 8,German
0,002094_HeavensRevenge-20110529-rju_de9-043.wav,in private network that not present in our masturabation,German
0,002875_HeavensRevenge-20110528-wng_de3-42.wav,in a Proton with effect is an event off login,German
0,003168_BRwgt-20140228-vcp_de8-058.wav,Eid computer for internet admin distance any IP address,German
0,004172_Crokoking-20110119-dbi_de10-155.wav,is it possible to grow strawberry answer from takli,German
0,005041_BRwgt-20140228-zpn_de11-019.wav,bus is twins bye good so kind 29 Titli shaped Yogi theatre wale,German
0,005269_DanielNeuhaus-20080303-jzi_de4-68.wav,antim mathematician operator activation permission eigenschaften Subah Tu chahiye,German
0,006608_Crokoking-20110119-dbi_de10-148.wav,experiment is a no 20,German
0,007112_Defense-20090727-wmu_de7-051.wav,1st November increases blood second,German
0,007350_HeavensRevenge-20110528-bno_de6-16.wav,taking my no 150 - 3 Guna paragraph 150,German
0,009441_Crazo-20091014-jzh_de5-003.wav,district versus office ka result,German
0,009829_HeavensRevenge-20110529-lge_HeavensRevenge-20110529-lge_de11-033.wav,the ones are clear on and on failing a snake stick,German
0,009881_Crokoking-20110119-dbi_de10-154.wav,nasta 2002 snan son name,German
0,010830_AdrianTovar-20080727-xjh_de11-144.wav,that's why I just after it can't be fired,German
0,010918_AnnaKarpekewitsch-20091129-jbu_de9-029.wav,jio phone se Idea Kaise Din Sehwag in a liar,German
0,010981_AdrianTovar-20080727-paz_de3-23.wav,this Republic toys went out in GB they did air kinderstars cabled house,German
0,014341_AdrianTovar-20080727-xjh_de11-149.wav,what items time in this stuff tribal I am,German
0,015885_HeavensRevenge-20110529-wfp_de2-11.wav,yah to Aishwarya sicherheitssysteme on Vishakha,German
0,018966_AndreyBarrientosCostaRica-20130720-pyu_de10-012.wav,BPL unterschrift hindisixi Mein Kunda dam built,German
0,020308_HeavensRevenge-20110529-uiz_de11-110.wav,echo point uthana sign and Secure location to allow water,German
0,021119_GeorgSimmel-20140421-ndq_de11-168.wav,inflexion tourist in Supreme,German
0,022869_DanielNeuhaus-20080303-hfe_de3-50.wav,the price of computer,German
0,023277_HeavensRevenge-20110529-klu_de7-071.wav,play Regulation and fun of therefore,German
0,024134_HeavensRevenge-20110528-baj_de3-31.wav,I am text converter FaceTime for comment on bacteria on,German
0,024542_DanielNeuhaus-20080303-zpn_de5-126.wav,T4 Unki councillors list,German
0,024901_BRwgt-20140228-bgs_de8-028.wav,when can we learn nets for FIFA is who seek to ensure that awesome under the next h,German
0,027068_BRwgt-20140723-trd_de11-007.wav,funky Stenography creation time,German
0,027250_HeavensRevenge-20110528-ezs_de3-14.wav,internazionale Shroff fitness Suna list Cup on Windows,German
0,027477_BRwgt-20140228-nrb_de11-139.wav,TB cook admit I na cal staff staff biotin,German
0,031092_HeavensRevenge-20110529-ujo_de2-11.wav,yah To Bata sicherheitssysteme on the Shakha,German
0,031439_HeavensRevenge-20110529-uiz_de11-113.wav,10 photo kholo carnivorous internet for Vendetta,German
0,Error,Error,Error
0,035083_HeavensRevenge-20110529-byr_de4-52.wav,image of riot Centre for next 3 Mein from you can avoid the more than a few dollars more than stand,German
0,035352_HeavensRevenge-20110529-mlp_de11-108.wav,machine from Ham is noise in the afternoon configured,German
0,035575_HeavensRevenge-20110529-lid_de7-032.wav,and from the fresh Solitaire can't come of their own,German
0,036377_HeavensRevenge-20110528-baj_de3-35.wav,this is begin our kind,German
0,036587_BRwgt-20140228-kwo_de8-122.wav,3 stage how busy a b house 3 hun,German
0,040458_DirkSchnelleWalka-20090902-qoy_de5-035.wav,fire hydrant exercise,German
0,040507_1337ad-20170321-bej_de6-51.wav,places to visit in halftones booking the common,German
0,Error,Error,Error
0,042283_BRwgt-20140718-oxg_de8-076.wav,Kithe the internal IP address book and iron computer M learn forgiven,German
0,042324_HeavensRevenge-20110528-ezs_de3-16.wav,I am intern at 293 what Rashi Khanna all cylinders Mukesh,German
0,043210_DirkSchnelleWalka-20140703-eyz_de8-004.wav,Bansa fashion School l m Darshan Karva song,German
0,044141_AdrianTovar-20080727-gov_de2-19.wav,account of the five height and 19 of them files,German
0,044230_BRwgt-20140228-msx_de8-141.wav,laughing didn't give MI note 9 work in,German
0,044642_HeavensRevenge-20110528-ory_de4-15.wav,yeah party wear suit Sachiv elemental free first Muslim ke Nariyal,German
0,047144_BRwgt-20140228-bgs_de8-027.wav,sudden b l mission kind returns give you can get it all done,German
0,048020_HeavensRevenge-20110528-rms_de10-032.wav,tender praxis Moses nuestro,German
0,049792_BRwgt-20140228-qlo_de8-099.wav,Shayad Hindi for style women,German
0,051059_DirkSchnelleWalka-20140703-eyz_de8-008.wav,police police physical test,German
0,052105_HeavensRevenge-20110529-llt_de7-095.wav,it's not send any wireless LAN in fast of towards implementable,German
0,052589_BRwgt-20140228-nrb_de11-135.wav,seat available for creation for hand,German
0,057011_DirkSchnelleWalka-20101217-iws_de11-105.wav,Achyutam usko with dragon for their interest,German
0,057039_HeavensRevenge-20110528-wng_de3-47.wav,Sanskrit vyakaran voice Tanu 20 quality of personnel at newport Ragam,German
0,057839_BRwgt-20140228-yvz_de8-056.wav,schism cooled I ne ke Khoon click the annual khuman,German
0,057846_HeavensRevenge-20110529-qmc_de6-54.wav,China westergren is right again as it is clear because,German
0,058036_HeavensRevenge-20110528-qbe_de10-013.wav,Poland Kovalam Khandan and fastener for Somwar,German
0,059966_BRwgt-20140718-oxg_de8-074.wav,I Nahin IP address ward inspire IP address of Thailand,German
0,062521_FlorianLaggwwwlaggat-20121008-lia_de4-73.wav,Nach Nach,German
0,062961_DirkSchnelleWalka-20140703-lys_de5-099.wav,sq ft in square shaped images with answer,German
0,064152_BRwgt-20140228-msx_de8-134.wav,Ahinsa Din Khet Me and him at Kabil thinking stunt,German
0,064244_1337ad-20170321-mba_de7-014.wav,buddhivantha please and I,German
0,064375_1337ad-20170321-mba_de7-019.wav,list list in rice in Kurnool route which we can give born,German
0,064711_Crazo-20091014-rfm_de7-008.wav,it was 5% of forces between A and B tech to give,German
0,066345_HeavensRevenge-20110529-ujo_HeavensRevenge-20110529-ujo_de2-05.wav,chicken pox on the system's contained in an refund bekenstein,German
0,067221_AdrianTovar-20080727-paz_de3-24.wav,the signal with two fragments and a loser in Saina Piston Thailand Saini,German
0,068597_BRwgt-20140228-yvz_de8-055.wav,assistant consigned fictitious concept superstition,German
0,071237_DanielNeuhaus-20080303-jzi_de4-67.wav,Mamta sukti mathematic for standard INOX Omaxe hotel,German
0,074584_HeavensRevenge-20110529-gbj_de9-138.wav,tellarindi party Funk mutual Jackson,German
0,075028_1337ad-20170321-bej_de6-54.wav,China white again status cloud because,German
0,075951_BRwgt-20140718-ynj_de4-21.wav,team rocket site and split of the communal even if the communal for Fashion Street,German
0,076421_HeavensRevenge-20110528-fum_HeavensRevenge-20110528-fum_de4-02.wav,social text width fit nagananda fossils,German
0,077032_HeavensRevenge-20110529-uiz_de11-111.wav,IOS for lannisters Ocean waters drink and anna and,German
0,077351_Crazo-20091014-jzh_de4-96.wav,give the telephone softwares location please,German
0,077925_GeorgSimmel-20140421-fdc_de5-085.wav,"noise shots 5,000 yoga",German
0,079244_BRwgt-20140718-oxg_de8-067.wav,stock market is a dynamic distribution all and the common,German
0,079736_DanielNeuhaus-20080303-jla_de5-133.wav,where this victory Street in the place than this a b Lisa sign,German
0,080020_GeorgSimmel-20140421-zvj_de8-056.wav,awesome account Aligarh cold in the early human,German
0,080819_HeavensRevenge-20110528-baj_de3-38.wav,Assamese station east on the and fan of both side eye and head,German
0,081119_Crazo-20091014-jzh_de5-002.wav,design Armstrong most criminal status card,German
0,081489_FrankJger-20111114-zmx_de5-040.wav,Maharashtra,German
0,083139_HeavensRevenge-20110529-wfp_de2-15.wav,Tanishq Ahmedabad,German
0,084379_DanielNeuhaus-20080303-zpn_de5-125.wav,Fortune select,German
0,085919_DirkSchnelleWalka-20140703-eyz_de8-009.wav,content sharing and how does it cost,German
0,086003_1337ad-20170321-ufl_de3-41.wav,yah by which state an alphabet X launch gufa,German
0,091468_BRwgt-20140228-vcp_de8-049.wav,TI Software elizabethan and and Fahad carbon,German
0,092616_DanielNeuhaus-20080303-zpn_de5-119.wav,importance of Euclid,German
0,093972_HeavensRevenge-20110529-rju_de9-039.wav,100 watt of an informed by staff in an 800,German
0,094044_HeavensRevenge-20110529-lge_de11-035.wav,takle on Samsung are canteen ka him for health,German
0,094768_AnnaKarpekewitsch-20091129-jbu_de9-032.wav,wooden outside 16 to 20 India,German
0,095571_HeavensRevenge-20110529-byr_de4-54.wav,does online offline with sensor of English photo,German
0,095638_BRwgt-20140723-idz_de3-64.wav,if the UK keyboard and started,German
0,096421_DirkSchnelleWalka-20140703-lys_de5-100.wav,taneem ki prakritik Drishya,German
0,096744_BRwgt-20140723-trd_de11-005.wav,San off Tata Sky take off 37,German
0,097158_GeorgSimmel-20140421-fdc_de5-084.wav,torch bearer,German
0,097198_1337ad-20170321-qbd_de3-02.wav,Divya please call induction light and heat after software and,German
0,100453_BRwgt-20140228-ewk_de8-070.wav,Institute na house in Hindi guide book,German
0,102070_BRwgt-20140228-ewk_de8-069.wav,pithale tum khana Khao fine underreporting land of Oregon,German
0,102608_DirkSchnelleWalka-20140703-lys_de5-097.wav,find the text after his to be on,German
0,102698_HeavensRevenge-20110529-ujo_de2-06.wav,name the house to state Handloom shop,German
0,102979_AdrianTovar-20080727-iif_de10-137.wav,the four economic,German
0,103312_AndreyBarrientosCostaRica-20130710-hct_de5-057.wav,of cables 5 height but it does in a mile,German
0,103845_AndreyBarrientosCostaRica-20130709-cjw_de11-026.wav,ice fertile half the hero's crystal,German
0,103988_BRwgt-20140723-trd_de11-008.wav,capital of an inner side of the synthesizer garritan,German
0,104353_GeorgSimmel-20140421-zvj_de8-052.wav,affinity and specificity acetic tournament,German
0,106176_BRwgt-20140228-yvz_de8-061.wav,yadi IP address book in field sports in foot height,German
0,106312_BRwgt-20140228-yvz_de8-064.wav,import scanner module fun einem Hukum,German
0,107272_HeavensRevenge-20110529-dif_de11-069.wav,understand the Forgotten about hagens capacity it comes to co-ordinate van,German
0,107355_1337ad-20170321-ntd_de11-140.wav,reviews of 40 watt and the book 68,German
0,107957_AdrianTovar-20080727-iif_de10-139.wav,apman Deedar owner failure on 25th 2010,German
0,107960_GeorgSimmel-20140421-cgr_de7-059.wav,men's T-shirts to initiate insightful records for soaking beard,German
0,109101_AdrianTovar-20080727-gov_de2-20.wav,Manchester theatre 135 19 5 year,German
0,109358_HeavensRevenge-20110528-qbe_de10-012.wav,people don't ask of the wind it amounted in build,German
0,109522_HeavensRevenge-20110529-ibo_de11-005.wav,son of third second and third list,German
0,109758_HeavensRevenge-20110529-gbj_de9-145.wav,the cost estimate with iron,German
0,110658_HeavensRevenge-20110529-ibo_de11-009.wav,taking doctor loan of installation,German
0,111506_HeavensRevenge-20110529-llt_HeavensRevenge-20110529-llt_de7-087.wav,Wheel on finger and I can hymen on off location on Window,German
0,113625_HeavensRevenge-20110528-wng_de3-49.wav,where can you can catch 833 a technique invest theorem,German
0,115554_DanielNeuhaus-20080303-cxf_de2-36.wav,54351 222,German
0,116197_HeavensRevenge-20110528-peo_de10-074.wav,can maintain it with the interest of asean,German
0,117205_HeavensRevenge-20110529-lge_de11-039.wav,translate payment to Windsor clearing up Paytm,German
0,118434_DanielNeuhaus-20080303-hfe_de3-59.wav,and telephone on shoes for the interference of light,German
0,118493_BRwgt-20140228-msx_de8-136.wav,Shayad Hindi Din par Lekh in Hindi,German
0,119073_HeavensRevenge-20110528-mqt_de5-108.wav,the sweet fairness is lean on click add a lotion,German
0,119532_DirkSchnelleWalka-20090901-ajk_de10-046.wav,tubidy.io new for the UN,German
0,121927_AndreyBarrientosCostaRica-20130709-cjw_de11-032.wav,25 with uska will I am f*** after inversion of collect,German
0,124707_HeavensRevenge-20110529-gbj_de9-142.wav,papers on display at following on Instagram DM guard Siwan Bihar,German
0,126104_DanielNeuhaus-20080303-jla_de5-131.wav,really not rest please turn off the meat for talk,German
0,128175_de11-071.wav,paranormal Mod song gift to see followers on Twitter,German
0,128981_AdrianTovar-20080727-paz_de3-16.wav,buy International Prabhat West Khanna house in this Mahesh,German
0,130513_HeavensRevenge-20110528-qbe_de10-014.wav,when one of toc for how click,German
0,132373_de11-070.wav,going home with as fibres on the sentence on what's on off,German
0,132713_Crazo-20091014-jzh_de4-95.wav,lips aur Khushbu uncle,German
0,133169_1337ad-20170321-amr_de4-68.wav,Unchi mathematician object of the present listen angles of insulated serum,German
0,133174_1337ad-20170321-vyr_de3-58.wav,an Allen stunt Orton Android stand for,German
0,134061_HeavensRevenge-20110528-ahk_HeavensRevenge-20110528-ahk_de10-091.wav,tube reader for Salon software from 0 to philosophy,German
0,134761_HeavensRevenge-20110529-ujo_de2-09.wav,it ok it house I am too much of an h,German
0,135452_DanielNeuhaus-20080303-cxf_de2-29.wav,I know the trees of a tree is propanol,German
0,136149_DirkSchnelleWalka-20090901-ajk_de10-044.wav,12 Greater Noida market,German
0,136546_Defense-20090727-wlz_de5-087.wav,nobbing stand Parliament Harkrishan monashee,German
0,138093_DanielNeuhaus-20080303-jla_de5-135.wav,t m in philim tissa from Britain,German
0,138951_1337ad-20170321-ntd_de11-135.wav,Vivek Paswan competition for hand,German
0,139144_1337ad-20170321-amr_de4-71.wav,BP stem and deflection and height on thank oven,German
0,142533_GeorgSimmel-20140421-cgr_de7-053.wav,pig in Gothic no installation for open house,German
0,143128_HeavensRevenge-20110528-tte_de11-129.wav,nerve supply of the test items with solvent,German
0,143789_1337ad-20170321-amr_de4-70.wav,Nick Cannon with human of demarcation across a 1st Baron,German
0,144429_AdrianTovar-20080727-xjh_de11-145.wav,show baby cows gazettes 12,German
0,147074_1337ad-20170321-blf_de9-164.wav,terminal of political awareness in Gujarat,German
0,149940_HeavensRevenge-20110529-dif_de11-062.wav,s s an open source proxy server software,German
0,151237_1337ad-20170321-blf_de9-165.wav,it is notified by an exit a Prateek,German
0,152657_HeavensRevenge-20110529-lvg_de9-143.wav,tourist information of sqlite in concrete father on an abstract,German
0,153519_HeavensRevenge-20110529-lzj_HeavensRevenge-20110529-lzj_de10-015.wav,vi command,German
0,153623_1337ad-20170321-hii_de9-146.wav,confirm that Swayam,German
0,160045_HeavensRevenge-20110529-lzj_de10-024.wav,question hyperlink contest is Osaka first atom,German
0,160249_HeavensRevenge-20110529-qmc_de6-56.wav,gift cards for inviting delete and portia and swimming pool,German
0,160653_DanielNeuhaus-20080303-hfe_de3-55.wav,Iske tum bhi orchestra hall Tum Alto monopole,German
0,161455_BRwgt-20140718-ynj_de4-14.wav,l Krish I Nick is your situation when you can form when this is for father,German
0,162743_Defense-20090727-wlz_de5-090.wav,Desire 10 August a continuation,German
0,163269_BRwgt-20140718-ynj_de4-18.wav,emodin Om Pandya caste list,German
0,165287_AdrianTovar-20080727-iif_de10-142.wav,and Paisa access point in the Navy of a few,German
0,165957_AdrianTovar-20080727-iif_de10-138.wav,29 April crash and suicide scene full full,German
0,168012_DanielNeuhaus-20080303-hfe_de3-51.wav,technique is perfect for slogan,German
0,171220_GeorgSimmel-20140421-cgr_de7-054.wav,kandom ke sath Vitran kin kin search food,German
0,171973_1337ad-20170321-blf_de9-167.wav,to start and veterinary star cast of mother stick to it,German
0,172905_AndreyBarrientosCostaRica-20130709-cjw_de11-023.wav,10 ki sure to go with that flows in Communications metal,German
0,175455_Defense-20090727-wlz_de5-092.wav,any thoughts for the king by not make it IDE,German
0,176268_GeorgSimmel-20140421-wyw_de3-68.wav,Peterson Denge DK Saini 38 East he picking up,German
0,176528_HeavensRevenge-20110528-peo_de10-076.wav,purity and feet long question pond's ministerium industries,German
0,176554_1337ad-20170321-bej_de6-47.wav,I have to push rank home content in truth and Winston,German
0,176695_de11-072.wav,subhadeep saste Mein bahan phone screen touch twist,German
0,177042_AdrianTovar-20080727-bxq_de11-069.wav,and distant the four heart and it can sugar or not where are you,German
0,177454_BRwgt-20140723-trd_de11-009.wav,Tik Tok is of history,German
0,178254_HeavensRevenge-20110529-qmc_de6-50.wav,switch off and effects on their phone,German
0,178376_1337ad-20170321-qbd_de2-39.wav,light it up then that was it it is OK first time,German
0,179315_HeavensRevenge-20110529-ghq_de11-150.wav,questions of learning balance reference,German
0,179524_AdrianTovar-20080727-paz_de3-22.wav,Ansal Heights period of in the whole thing inside famu Christina Olympia,German
0,179605_BRwgt-20140723-trd_de11-004.wav,Jackie 4 with the theme of - voice over,German
0,181772_1337ad-20170321-czb_de11-100.wav,Norman the Cine Star Plus Malai mission the after they are,German
0,181912_HeavensRevenge-20110528-ahk_de10-100.wav,tempering on international resources ups and loss,German
0,182103_HeavensRevenge-20110528-bno_de6-19.wav,Krishna father and supermarket system never common,German
0,182524_1337ad-20170321-kgs_de11-039.wav,we had a nest and please comment Arvind Akela hun aapka game,German
0,182727_ALI-20130113-iyl_de10-018.wav,aap Naukari of interest wall,German
0,185195_Crokoking-20110119-dbi_de10-151.wav,innum access points table,German
0,185780_HeavensRevenge-20110528-bno_de6-20.wav,thefatrat come string the Norman kinda look and listen,German
0,186911_HeavensRevenge-20110528-baj_de3-32.wav,Hero poster board Western classic books Tum just have sex with ghost,German
0,187246_HeavensRevenge-20110529-lzj_de10-019.wav,a comment that X is known for liquid,German
0,188010_HeavensRevenge-20110529-lid_de7-028.wav,lyrically stiefel 800 - 400 sq m fastens bus fare 221,German
0,188210_HeavensRevenge-20110528-rms_de10-034.wav,problem lyrics nation of women from inside,German
0,189070_HeavensRevenge-20110529-uiz_HeavensRevenge-20110529-uiz_de11-105.wav,poster most visited and regular water for at least,German
0,191574_Crazo-20091014-jzh_de5-001.wav,create photo collage,German
0,195439_AndreyBarrientosCostaRica-20130720-pyu_de10-009.wav,purani 10 code 8738,German
0,195621_HeavensRevenge-20110529-kux_de10-068.wav,Houston Texas plant staff have invested and inside the flesh,German
0,197075_HeavensRevenge-20110529-klu_de7-073.wav,the fashion sports wear western dresses king and clubs,German
0,198382_DirkSchnelleWalka-20101217-swz_de7-080.wav,near the window can think like weekends Karnataka win,German
0,200667_1337ad-20170321-yqy_de10-057.wav,breast of organs to Haram,German
0,201159_HeavensRevenge-20110528-bno_de6-12.wav,Craft on sponsorship ABB analogue and with whom,German
0,201512_FrankJger-20111114-zmx_de5-045.wav,function,German
0,204381_DirkSchnelleWalka-20101217-swz_de7-077.wav,Rajasthan Telugu Mulakat Sansthan Nathawat on,German
0,207798_HeavensRevenge-20110528-fum_de4-10.wav,latest countries are from Fossil Aslam mistake next Bayan,German
0,209425_Defense-20090727-wmu_de7-055.wav,China in Trident kids song,German
0,211105_1337ad-20170321-mba_de7-017.wav,The Sangai please refer lets the gun Christ Muslim women in outlook 2007,German
0,211393_1337ad-20170321-ufl_de3-46.wav,main what is an expression in net jacket and about,German
0,211782_HeavensRevenge-20110528-baj_de3-34.wav,porifera quotes on always with your wife is quite fun book stamp with us,German
0,214480_BRwgt-20140228-qlo_de8-096.wav,Kund French Fashion fans with lyrics in English,German
0,219247_HeavensRevenge-20110529-ibo_de11-012.wav,Imam doesn't mean the Gomez and simply sticking plaster long,German
0,219389_HeavensRevenge-20110529-ghq_de11-148.wav,what has the most extensive penis,German
0,220003_HeavensRevenge-20110529-mdg_de8-033.wav,default files in can sqlite and bar,German
0,220068_DanielNeuhaus-20080303-jla_de5-132.wav,tummy fat cutting cake in YouTube,German
0,Error,Error,Error
0,222757_DirkSchnelleWalka-20101217-swz_de7-078.wav,skokka.in Utsav ab Honge,German
0,222984_HeavensRevenge-20110528-ory_de4-12.wav,percentage of minor forest in next to failure for the iPhone 5C,German
0,223802_1337ad-20170321-urq_de11-015.wav,Pincon spirit and reasonable price,German
0,225106_HeavensRevenge-20110529-dif_de11-061.wav,basic container for Mata gift,German
0,225954_HeavensRevenge-20110529-ghq_de11-145.wav,play on,German
0,226563_BRwgt-20140228-msx_de8-137.wav,CNT ke andar Shobha 100 1st,German
0,226933_HeavensRevenge-20110529-wfp_de2-14.wav,IAS kill us and be a star car I will get most,German
0,226992_HeavensRevenge-20110529-kux_de10-066.wav,list of unforgettable it's time it's showtime,German
0,227292_BRwgt-20140723-trd_de11-006.wav,with happy at that the British a star to fall you,German
0,229839_HeavensRevenge-20110529-dif_de11-065.wav,internet on beta of event script Oracle transparent proxy,German
0,230389_HeavensRevenge-20110528-ory_de4-17.wav,my Morgan stylish writing over sirf Asansol gana,German
0,232409_DirkSchnelleWalka-20090901-ajk_de10-040.wav,Hrithik Hrithik Hrithik,German
0,Error,Error,Error
0,232715_HeavensRevenge-20110528-qbe_HeavensRevenge-20110528-qbe_de10-008.wav,convert extract from Prasad styles font from build,German
0,233006_HeavensRevenge-20110529-kux_de10-065.wav,National Dastak,German
0,233831_AndreyBarrientosCostaRica-20130709-cjw_de11-030.wav,kya bye bear Despicable Me 1 list of about,German
0,236017_GeorgSimmel-20140421-ndq_de11-170.wav,PV Sindhu Olympic team in Clash Vaidik,German
0,236172_1337ad-20170321-yqy_de10-058.wav,test of an industry of inside its underside and,German
0,236217_1337ad-20170321-amr_de4-74.wav,Machi machi with a that wasn't at an atheist vasanshah funded,German
0,236355_1337ad-20170321-urq_de11-016.wav,virtual link conditioner for women hairstyle and,German
0,236494_HeavensRevenge-20110529-lzj_de10-017.wav,the comment are taxes for kids in formula in with,German
0,236772_FlorianLaggwwwlaggat-20121008-lia_de4-75.wav,mafi mafi is fine,German
0,238916_1337ad-20170321-ntd_de11-142.wav,used it for soups and start a fashion among youngsters at the famous,German
0,240750_AndreyBarrientosCostaRica-20130710-lud_de10-158.wav,the of prime browser was unveiled by Silver Sable forks,German
0,243460_HeavensRevenge-20110528-tte_de11-128.wav,Vinod song with list of Finance at home brands,German
0,246917_HeavensRevenge-20110529-mlp_de11-107.wav,if you Park headphone gateways Imran with David,German
0,247645_AdrianTovar-20080727-xjh_de11-142.wav,used its faults and start with size and also kissing miss,German
0,247727_HeavensRevenge-20110529-ibo_de11-007.wav,compound interest along the finished Visarjan,German
0,247767_HeavensRevenge-20110528-peo_de10-072.wav,alternativa dost,German
0,248741_HeavensRevenge-20110529-mlp_de11-106.wav,tashan-e-ishq pokathe ka photo Khol button document,German
0,249250_Defense-20090727-wlz_de5-085.wav,Mr nonsense afternoon c5000 program,German
0,249546_1337ad-20170321-vzg_de9-058.wav,nonsense honour 8 intuit,German
0,250358_DirkSchnelleWalka-20140703-lys_de5-101.wav,bust of the poem I am sleep medicine by Ranjan,German
0,253182_1337ad-20170321-hii_de9-145.wav,question on Titan emitted ban,German
0,253355_DirkSchnelleWalka-20140703-lys_de5-098.wav,cal ka tha script from Suchna analyse the following today open,German
0,253892_DirkSchnelleWalka-20101217-swz_de7-081.wav,Alexander McQueen surprise inside eclipse 1,German
0,254022_DanielNeuhaus-20080303-hfe_de3-56.wav,lekin form Kaise Kundan Sawant,German
0,255287_HeavensRevenge-20110529-mlp_de11-103.wav,when is transform your poor,German
0,255858_GeorgSimmel-20140421-wyw_de3-71.wav,K2 international music,German
0,257381_HeavensRevenge-20110529-lvg_HeavensRevenge-20110529-lvg_de9-141.wav,what rhymes with students,German
0,257424_AdrianTovar-20080727-xjh_de11-147.wav,the first track hun FIR favourite ko baby cows gazettes,German
0,257640_HeavensRevenge-20110528-baj_de3-33.wav,which food to an illusion thunder power house ke phone,German
0,259070_1337ad-20170321-bej_de6-56.wav,the first heart Pathan boy in Delhi 2020,German
0,259777_HeavensRevenge-20110528-rms_de10-029.wav,download fun OpenOffice water in a headphone courts at 52 HP fuel,German
0,260575_GeorgSimmel-20140421-wyw_de3-72.wav,Anaika soti hot in a recent,German
0,260812_BRwgt-20140718-oxg_de8-072.wav,yup I will tell you thousands and also I give that,German
0,260997_BRwgt-20140228-vcp_de8-053.wav,kya computer condition time self Abhinandan,German
0,261529_GeorgSimmel-20140421-fdc_de5-079.wav,Imran Khan's in Patna fast Corpus luteum Laga,German
0,263846_BRwgt-20140718-hof_de9-169.wav,Mammootty for Vishnu fitstart 76,German
0,265550_1337ad-20170321-ntd_de11-136.wav,Vikram vintage fucen Sewing istinja,German
0,267043_GeorgSimmel-20140421-zvj_de8-059.wav,zapier Kaise piton anuma,German
0,267454_DirkSchnelleWalka-20101217-iws_de11-100.wav,t-rex normal size in After Effects,German
0,268744_GeorgSimmel-20140421-cgr_de7-055.wav,to an Shadow woman,German
