,Filename,text,language
0,560431_BRwgt-20140723-idz_de3-68.wav,Siddharth main gate designs and it is Sahi fish catching,German
0,560535_de11-063.wav,and hearts and Windows were prescribed,German
0,563102_HeavensRevenge-20110528-peo_HeavensRevenge-20110528-peo_de10-067.wav,history of inside dikha Knocking on button time delay query,German
0,563317_1337ad-20170321-vyr_de3-62.wav,message Dekho fal item is out lucky event,German
0,564037_HeavensRevenge-20110529-lid_de7-036.wav,Akshara Singh ka B for words of 1 is,German
0,565212_DirkSchnelleWalka-20140703-eyz_de8-010.wav,I guess that's ok farsons Beta Shukla Pyar,German
0,565880_BRwgt-20140228-zpn_de11-021.wav,assists you ko synextic is your good kite net,German
0,566107_HeavensRevenge-20110529-uiz_de11-106.wav,taknik Upadhyay ka photo Khol document icecream,German
0,566479_1337ad-20170321-ntd_de11-143.wav,history of forming the head of a,German
0,568116_BRwgt-20140723-idz_de3-60.wav,why I think footista and asean,German
0,568402_BRwgt-20140228-nrb_de11-134.wav,which staff is syllabus langify Hai staff,German
0,570204_DirkSchnelleWalka-20140703-eyz_de8-011.wav,if it inspires and has music at anus causes,German
0,571838_HeavensRevenge-20110529-kux_HeavensRevenge-20110529-kux_de10-064.wav,desktop inside it confirm Viram and methods they are,German
0,572179_HeavensRevenge-20110529-klu_de7-067.wav,twist in the LBS plan UTI dose after school students as powerful and find that,German
0,572194_HeavensRevenge-20110529-wfp_de2-12.wav,and I'm sure there are few site for Leon,German
0,573183_HeavensRevenge-20110528-woz_de9-147.wav,where is IT City telephone number why no fear and stripes why,German
0,574011_BRwgt-20140228-ewk_de8-072.wav,yah by voter booth on earth,German
0,576668_GeorgSimmel-20140421-zvj_de8-054.wav,beauty shop in Kota finish,German
0,577047_HeavensRevenge-20110529-llt_de7-092.wav,parantu rathalos networking tips to study Sonal and answer Shahid,German
0,577557_DirkSchnelleWalka-20090901-ajk_de10-043.wav,820 Pikachu number plate,German
0,577851_1337ad-20170321-qbd_de3-01.wav,in functions would diminish loan quickly accurate,German
0,578139_AdrianTovar-20080727-gov_de2-23.wav,EVS chapter 4th Alice in only Baje bar,German
0,578941_HeavensRevenge-20110529-ujo_de2-07.wav,where is first AC and candy house to problem was a funnel,German
0,579057_BRwgt-20140228-bgs_de8-022.wav,when the spirit of latest ministry Kenneth w Knight,German
0,580384_HeavensRevenge-20110529-kux_de10-069.wav,give the sky inside the place,German
0,582707_AdrianTovar-20080727-bxq_de11-070.wav,I never drink with just fibres on the synthons one note song,German
0,582829_HeavensRevenge-20110529-lid_de7-029.wav,important face card is important for faasos characters at exactly Riders,German
0,585115_HeavensRevenge-20110528-ory_de4-11.wav,tasviren Jan 16 to 20,German
0,586110_1337ad-20170321-hii_de9-151.wav,search for phellogen Pelican,German
0,586462_HeavensRevenge-20110529-mdg_de8-038.wav,a torque can be part of a good sign,German
0,590279_AnnaKarpekewitsch-20091129-jbu_de9-034.wav,super services in static IP address in form 7 and result,German
0,590562_HeavensRevenge-20110528-baj_de3-36.wav,Lagana Krishna Bhajan and f*** hard to ensure a nice quotes on our question,German
0,594498_ALI-20130113-iyl_de10-026.wav,custom table clock signal flip house,German
0,594548_BRwgt-20140718-ynj_de4-15.wav,u Pi balance elements video for so long kennels,German
0,594948_1337ad-20170321-kgs_de11-034.wav,Deepak Sampat ambulance Akhilesh in Skype ID,German
0,594998_HeavensRevenge-20110529-dif_de11-064.wav,diet for Thyroid,German
0,597143_GeorgSimmel-20140421-cgr_GeorgSimmel-20140421-cgr_de7-051.wav,MK set plastic,German
0,598269_ALI-20130113-iyl_de10-023.wav,reason for refund is thank comment harkins percent,German
0,599536_AnnaKarpekewitsch-20091129-jbu_de9-026.wav,Manthan D IP addressing medium post adhesive and a preformed acceleration,German
0,600505_1337ad-20170321-urq_de11-018.wav,I Nada could have is it was the pure heated,German
0,601754_HeavensRevenge-20110529-byr_de4-47.wav,if I'm used for Thailand by Nigam Arsenal's calculation,German
0,601926_AdrianTovar-20080727-bxq_de11-076.wav,fanuc its movie schweizer and give its unlimited on Shisha height,German
0,602475_GeorgSimmel-20140421-ptj_de4-79.wav,kimat Mata ka mandir Kaise screenshot in in Python seimitsu Orton in,German
0,605881_BRwgt-20140228-bgs_de8-025.wav,TV signal and spits yellow spirit first health,German
0,605883_Defense-20090727-wmu_de7-050.wav,iski Tanhai ke mans ka video,German
0,606455_BRwgt-20140228-msx_de8-140.wav,for them during the first month year in eagan,German
0,608900_DirkSchnelleWalka-20090901-ajk_de10-047.wav,Apollo physical stamina and strength,German
0,608996_HeavensRevenge-20110529-ujo_de2-08.wav,latest important question for bioinformatics,German
0,611108_HeavensRevenge-20110528-mqt_de5-107.wav,Pizza is forever and enquiry Rakha Putti Daman,German
0,611848_FrankJger-20111114-zmx_de5-044.wav,Jesus Christ,German
0,611975_BRwgt-20140228-vcp_de8-056.wav,schism Kund Aaine Ke kul Clinton Yakub Memon,German
0,612738_DirkSchnelleWalka-20101217-swz_de7-076.wav,aavishkar few and then mother can give birth,German
0,612757_1337ad-20170321-vzg_de9-060.wav,when the prescribing for habitant mahatva in where,German
0,613556_BRwgt-20140228-qlo_de8-094.wav,PPF account which state have cyclist conservation Canadian,German
0,614543_GeorgSimmel-20140421-ptj_de4-85.wav,mathematician such an account get income,German
0,616114_HeavensRevenge-20110528-mqt_de5-103.wav,Itna is refundable for it to list of lists Suzanne,German
0,616324_HeavensRevenge-20110528-tte_de11-125.wav,kaun sa first statement where he was discussed with the software,German
0,618088_GeorgSimmel-20140421-zvj_de8-057.wav,Iman Iman as having salt in,German
0,618564_Crazo-20091014-rfm_de7-002.wav,China whitelist not Union gold list with us version,German
0,618595_DanielNeuhaus-20080303-jzi_de4-74.wav,mathematics film all things present of 300,German
0,618695_Crazo-20091014-rfm_de7-007.wav,free Fashion special bonus for fashion School,German
0,620983_DanielNeuhaus-20080303-jzi_de4-72.wav,TV function,German
0,622904_DirkSchnelleWalka-20140703-lys_DirkSchnelleWalka-20140703-lys_de5-096.wav,Kana Kana Ka Bayan,German
0,623985_DirkSchnelleWalka-20101217-swz_de7-075.wav,Vishnu DJ Nigam contractor list,German
0,624751_HeavensRevenge-20110528-qbe_de10-015.wav,vi command block sukanta Mohan,German
0,625205_Crazo-20091014-cey_de11-049.wav,this software can I signal decoder,German
0,625707_DanielNeuhaus-20080303-hfe_de3-57.wav,team is mahine,German
0,626667_Crazo-20091014-jzh_de5-004.wav,Dushman Dushman Tu Ha,German
0,627279_HeavensRevenge-20110528-woz_de9-145.wav,techos,German
0,627372_AndreyBarrientosCostaRica-20130709-cjw_de11-027.wav,bhai catastrophic contains more bi from net National plastic sign,German
0,628639_BRwgt-20140228-qlo_de8-101.wav,Keep Calm its so I am give you know all district with a chicken,German
0,628872_HeavensRevenge-20110529-dif_de11-066.wav,Tekken in health Austin internet Felton,German
0,Error,Error,Error
0,631159_GeorgSimmel-20140421-zvj_de8-051.wav,suspicious software can I f*** himself at wedding,German
0,631727_1337ad-20170321-vyr_de3-61.wav,Pushpa thanks 49 equation from perfect organ up,German
0,631862_HeavensRevenge-20110528-peo_de10-070.wav,movie review on political on that side,German
0,633253_1337ad-20170321-vzg_de9-053.wav,new company listed on the first listening is the SI unit,German
0,633880_BRwgt-20140718-hof_de9-174.wav,transfers both can telephone 10 tourist given by,German
0,634372_BRwgt-20140718-oxg_de8-071.wav,opt out on the date but it isn't it,German
0,634700_HeavensRevenge-20110529-klu_de7-065.wav,the cricket spin hall to 15 port,German
0,634723_HeavensRevenge-20110529-llt_de7-088.wav,Disha head on photo in super boxing,German
0,635051_GeorgSimmel-20140421-zvj_de8-058.wav,it comes to time infinite heart means Aane IPL Kaise,German
0,635092_1337ad-20170321-yqy_de10-056.wav,affair for school student list,German
0,638510_GeorgSimmel-20140421-ndq_GeorgSimmel-20140421-ndq_de11-162.wav,analytical e marketing class 8,German
0,638678_GeorgSimmel-20140421-fdc_de5-082.wav,lipstick under under him front load with a heart on his drum kit,German
0,639838_1337ad-20170321-kgs_de11-038.wav,note some sign up game is mistake,German
0,641811_HeavensRevenge-20110528-qbe_de10-011.wav,Rahatani ETV Manasu film Louis income,German
0,641832_BRwgt-20140228-vcp_de8-052.wav,ya price in that I nashpati fisher ictect and window,German
0,642248_BRwgt-20140723-idz_de3-66.wav,if you buy online from 20 SL,German
0,642901_HeavensRevenge-20110529-ghq_de11-146.wav,it has been described as a function on teeth hurt on standard and accessories,German
0,647362_HeavensRevenge-20110529-llt_de7-090.wav,topisone pata hai lekin of car can file in the handmaiden,German
0,648139_DanielNeuhaus-20080303-jzi_de4-73.wav,mathematician forest rest house office Officer jobs,German
0,649895_1337ad-20170321-mba_de7-016.wav,anthapura Kunda,German
0,650066_1337ad-20170321-qbd_de3-04.wav,Yahan in direction that develops for talent,German
0,650112_AnnaKarpekewitsch-20091129-jbu_de9-027.wav,to telephone number give the snow and I am forget MI,German
0,650176_HeavensRevenge-20110529-lzj_de10-021.wav,the comments are taxes in flower for home,German
0,650471_BRwgt-20140228-kwo_de8-117.wav,interest in the Expo 9 sheep in the system and flag,German
0,650860_DanielNeuhaus-20080303-cxf_de2-34.wav,the computer virus in China operate fake and Frank,German
0,651408_HeavensRevenge-20110528-qbe_de10-009.wav,spoken l track record PM of a window 12,German
0,652611_ALI-20130113-iyl_de10-027.wav,does it never block a held 14 sale Mein laser,German
0,653775_HeavensRevenge-20110529-lid_de7-034.wav,awesome 4th practice to share a few Cosmo City game,German
0,654324_HeavensRevenge-20110529-klu_HeavensRevenge-20110529-klu_de7-064.wav,Stanford items act of treason,German
0,655018_AnnaKarpekewitsch-20091129-jbu_de9-028.wav,Megha clients can see any IP address in Thailand,German
0,655059_DirkSchnelleWalka-20101217-iws_de11-097.wav,income taxation by the images of viswasam,German
0,655624_1337ad-20170321-czb_de11-095.wav,YouTube Monu East Asian tour list,German
0,656067_DanielNeuhaus-20080303-hfe_de3-52.wav,Mithun Outlook the SSL cypher techniques,German
0,658000_HeavensRevenge-20110529-ghq_de11-149.wav,what are the most from Windows 10 via ghost after blenheim,German
0,659362_HeavensRevenge-20110528-woz_de9-143.wav,protein finished in house class in concrete and abstract noun,German
0,659764_DanielNeuhaus-20080303-zpn_de5-120.wav,crocs shoes,German
0,660178_HeavensRevenge-20110528-ory_de4-16.wav,Madan Singh ko nasht home first loan,German
0,663210_DanielNeuhaus-20080303-jzi_de4-75.wav,mathematics kind of movies of the mic in Tekken 3,German
0,664381_HeavensRevenge-20110528-rms_de10-030.wav,Aaina Anjuman snap on Friday streets of you go,German
0,665125_HeavensRevenge-20110529-tng_de8-115.wav,Tekken 3 Din should speed of death an Inside Out,German
0,666983_GeorgSimmel-20140421-zvj_de8-055.wav,assistance and fictitious concept 2:15,German
0,667782_HeavensRevenge-20110528-ezs_de3-11.wav,the theatre of the finished Amavas lund order theatre is an AWS Lambda,German
0,668201_de11-067.wav,ya to convert 6 class in first click,German
0,669298_Crazo-20091014-cey_de11-055.wav,Annu Singh + first van,German
0,669488_HeavensRevenge-20110529-rju_de9-046.wav,so much that you start I am your strength,German
0,670276_HeavensRevenge-20110529-gbj_HeavensRevenge-20110529-gbj_de9-136.wav,TOEFL ETS the most and Shan a composite Oram Indian,German
0,672905_FlorianLaggwwwlaggat-20121008-lia_de4-74.wav,Mati Mati,German
0,674151_HeavensRevenge-20110528-bno_HeavensRevenge-20110528-bno_de6-11.wav,scorm cloud based it can overcome any kind,German
0,674579_BRwgt-20140228-kwo_de8-115.wav,stick and seed and shoots beautiful of the earth and can society,German
0,675053_BRwgt-20140228-ewk_de8-068.wav,restart Fakir antim computer minutes ball python,German
0,Error,Error,Error
0,677016_ALI-20130113-iyl_de10-024.wav,Twitter link contest is avsar ke first Telugu,German
0,679451_HeavensRevenge-20110528-woz_de9-149.wav,open Xeon X prize Ivan B wires x and,German
0,681362_DanielNeuhaus-20080303-jla_de5-126.wav,Fort conquer without list,German
0,683389_HeavensRevenge-20110529-mdg_de8-034.wav,tip tip Paus nibandh Bank,German
0,683663_HeavensRevenge-20110529-lzj_de10-023.wav,Indian 510 comment hard and fast,German
0,684325_1337ad-20170321-yqy_de10-055.wav,aftermorning does Merit and uninstall started telling control,German
0,685966_Black_Galaxy-20080530-xzb_de11-098.wav,Pune station to kin kin for 9 exam date sorting covers,German
0,686504_DanielNeuhaus-20080303-hfe_de3-54.wav,I'll start and common interest on tax on pension income,German
0,687869_BRwgt-20140228-ewk_de8-063.wav,so I need and importance of community and Kasim,German
0,688698_1337ad-20170321-urq_de11-014.wav,incliner connect via kaun sa 6 8 violin,German
0,689293_GeorgSimmel-20140421-ndq_de2-01.wav,Mansa suit 658,German
0,691482_HeavensRevenge-20110529-tng_de8-120.wav,3 padam syllables mission Din Byan ration montien,German
0,692219_HeavensRevenge-20110529-lid_HeavensRevenge-20110529-lid_de7-027.wav,oculus 2 Phase 1 come my speakerphone connection and brother,German
0,694168_DanielNeuhaus-20080303-jzi_de4-70.wav,we can an optimal way of Australia,German
0,695736_AdrianTovar-20080727-paz_de3-17.wav,give me school onsite and she is wearing,German
0,699245_BRwgt-20140723-trd_de11-011.wav,Geeta Shlok,German
0,699672_HeavensRevenge-20110528-rms_HeavensRevenge-20110528-rms_de10-027.wav,the final per blockheads Putin Samy Aliza,German
0,699796_AndreyBarrientosCostaRica-20130720-pyu_de10-004.wav,Jat Express in this situation is no you don't Aadam build,German
0,700313_HeavensRevenge-20110529-lzj_de10-016.wav,I am fork and I am from the block and hyperlink and,German
0,702969_BRwgt-20140228-nrb_de11-141.wav,Ki Aaegi main height growth of star thank you should,German
0,705065_HeavensRevenge-20110529-mdg_de8-032.wav,touch mobile telephone most rewarding frequenting the housing,German
0,707745_DirkSchnelleWalka-20101217-iws_de11-103.wav,manasthan Saumya dwara,German
0,709035_Crazo-20091014-cey_de11-058.wav,Hanuman code Axis bank on famous,German
0,711195_DanielNeuhaus-20080303-jla_de5-129.wav,house Norman from velocity with a screenshot key,German
0,714010_Black_Galaxy-20080530-xzb_de11-101.wav,Westindies of circuits PDF,German
0,714213_1337ad-20170321-hii_de9-150.wav,just am I would internet runs after live stream,German
0,714339_AdrianTovar-20080727-paz_de3-19.wav,the house lekhan thatching starfish The Monk,German
0,714858_de11-064.wav,spinner sketch for Thailand,German
0,716441_BRwgt-20140228-nrb_de11-132.wav,assist and start the season schedule with the of district Hatia 11 12,German
0,716642_BRwgt-20140228-ewk_de8-066.wav,about the author of that it is the internet,German
0,717772_HeavensRevenge-20110529-tng_de8-116.wav,industry award in child's gift and that mean,German
0,720170_HeavensRevenge-20110529-mdg_de8-039.wav,when is Cafe their start point for pure,German
0,720524_HeavensRevenge-20110529-gbj_de9-144.wav,pic of Tum apna and with hooks or concrete merise Palat song,German
0,720846_AdrianTovar-20080727-gov_de2-22.wav,fish Tikka International of Oxford,German
0,722306_BRwgt-20140718-oxg_de8-070.wav,SM Street na house in Hind Inox,German
0,722665_HeavensRevenge-20110529-dif_de11-063.wav,in health and Wellness replaced it,German
0,722697_HeavensRevenge-20110529-uiz_de11-108.wav,Russian from homelessness in the afternoon launched in cricket,German
0,723220_DanielNeuhaus-20080303-jla_de5-130.wav,tell me about the meat eating deposite on the stomata sign,German
0,725475_BRwgt-20140228-nrb_de11-140.wav,Tanki Tanki Tanki 246,German
0,727170_1337ad-20170321-czb_de11-103.wav,penis pump from your bottom,German
0,727375_1337ad-20170321-urq_de11-017.wav,Ananda of a bond enzyme,German
0,727902_DirkSchnelleWalka-20140703-lys_de5-104.wav,equifinance Ham kya koi for your house,German
0,728211_BRwgt-20140723-trd_de11-003.wav,imply medium for education,German
0,728734_1337ad-20170321-amr_de4-67.wav,manfors Upadhyay mathematics for standard in experiments with spelling,German
0,730516_BRwgt-20140228-kwo_de8-121.wav,what's time is it speech on the month of,German
0,732206_Defense-20090727-wmu_de7-054.wav,turn on with drinking waiting type point,German
0,735100_1337ad-20170321-ufl_de3-40.wav,perfect warendorf under 1500,German
0,735188_1337ad-20170321-yqy_de10-053.wav,Indian and western sarcastic abundance and,German
0,735608_AndreyBarrientosCostaRica-20130710-hct_de5-061.wav,Standard 6 ohm I need for a software,German
0,737130_Crazo-20091014-cey_de11-053.wav,how do user can I get in a digital signature for wonder,German
0,738240_Defense-20090727-wmu_de7-056.wav,tsp tarnished Mein Kab Hogi Aamir Khan,German
0,739190_HeavensRevenge-20110529-mlp_de11-109.wav,tatsam for some of these Ashok Gupta and Co CA,German
0,739457_1337ad-20170321-hii_de9-152.wav,call Agam,German
0,739567_HeavensRevenge-20110529-tng_de8-114.wav,Lemon Tree Restaurant who was the pole Havells,German
0,740629_1337ad-20170321-kgs_de11-040.wav,Vodafone m s,German
0,740829_1337ad-20170321-ufl_de3-43.wav,time Boston,German
0,741125_HeavensRevenge-20110528-baj_HeavensRevenge-20110528-baj_de3-30.wav,effect Karta booster Monster 2 good,German
0,741302_BRwgt-20140723-idz_de3-63.wav,father give your life and your writing,German
0,741342_AnnaKarpekewitsch-20091129-jbu_de9-030.wav,mention an Naman best buy something,German
0,741425_DirkSchnelleWalka-20101217-iws_de11-104.wav,tasvir ka Qubool Hai song,German
0,741693_1337ad-20170321-mba_de7-015.wav,answer and guide,German
0,744119_Black_Galaxy-20080530-xzb_de11-097.wav,and conflict session by an effective team is output process,German
0,744314_HeavensRevenge-20110528-fum_de4-07.wav,Panama Sumit question kuddus Temple Andaaz phaagan,German
0,746074_Crazo-20091014-cey_de11-054.wav,chudasi baat ka Akbar Khan,German
0,746941_AndreyBarrientosCostaRica-20130710-hct_de5-053.wav,is kind of informative built within the indicated for gasoline is,German
0,748060_BRwgt-20140228-yvz_de8-063.wav,so I never understand port a line of IP address,German
0,748984_DanielNeuhaus-20080303-cxf_de2-30.wav,open positive eigenschaften,German
0,749383_HeavensRevenge-20110529-byr_de4-49.wav,write a program counter and Measurement V Tandav,German
0,750744_BRwgt-20140718-oxg_de8-069.wav,Revital h tum khana Khao final undergone Potter Milana Falcon,German
0,752182_AndreyBarrientosCostaRica-20130710-lud_de10-151.wav,Anu Mein access points 2067,German
0,753558_Crazo-20091014-cey_de11-050.wav,per video conferencing on internet value with is very good message for winter,German
0,754171_GeorgSimmel-20140421-ptj_de4-83.wav,I am string location of the voice USA House ki full enquiry,German
0,755472_AndreyBarrientosCostaRica-20130710-lud_de10-152.wav,Jagadish 18 is Kshetra,German
0,756354_AdrianTovar-20080727-bxq_de11-077.wav,Mia Hai Are Bhai uski behan sisters and gift,German
0,757601_HeavensRevenge-20110528-ezs_de3-17.wav,chemist Khol Asian Spice country,German
0,757859_AdrianTovar-20080727-xjh_de11-151.wav,MIT einem Vivek Angel Pharma Sujangarh it where,German
0,758347_AndreyBarrientosCostaRica-20130710-lud_de10-159.wav,the day 10 packet Museum you but the internet isn't that bad,German
0,758771_GeorgSimmel-20140421-ptj_de4-81.wav,Mati Mati se Akhian Nu Shivir in used to experiment have focused,German
0,760455_AdrianTovar-20080727-bxq_de11-071.wav,Hanuman much think it is the fall apart by the,German
0,760569_AdrianTovar-20080727-bxq_de11-072.wav,Isha with sleep system there in Sanskrit on test,German
0,762232_1337ad-20170321-vzg_de9-054.wav,Ehsas photo collage images white for B,German
0,762912_HeavensRevenge-20110529-lvg_de9-142.wav,Amazon associate forensic stickering Sunita guard cell on the earth,German
0,763435_HeavensRevenge-20110528-wng_de3-45.wav,professionals of portsmouth America America with cartoon,German
0,766128_HeavensRevenge-20110529-qmc_de6-53.wav,Sushmita live on the lighted,German
0,766524_AdrianTovar-20080727-iif_de10-140.wav,and Johnson contest winner fat but long they keep a address in common,German
0,766672_1337ad-20170321-mba_de7-012.wav,concrete in normal control and B are cartoon not even,German
0,766830_GeorgSimmel-20140421-ndq_de11-163.wav,admission kimon High Tension father International 2016,German
0,767218_HeavensRevenge-20110528-ahk_de10-098.wav,only 10% listen shoelaces and hangers for losers,German
0,768449_GeorgSimmel-20140421-wyw_GeorgSimmel-20140421-wyw_de3-66.wav,a Sonnet 60 by women in Noida with from front psl,German
0,769347_AndreyBarrientosCostaRica-20130710-lud_de10-156.wav,Ti next ban gaya rate of Himalaya Apartment Khan,German
0,770063_DirkSchnelleWalka-20140703-eyz_de8-005.wav,theatre mode on,German
0,770883_Crokoking-20110119-dbi_de10-150.wav,Muslim Hasi wali gift,German
0,771322_HeavensRevenge-20110528-rms_de10-035.wav,Ryukendo Krishnan photo Kiska avoid Dayan,German
0,771436_1337ad-20170321-vzg_de9-055.wav,as a gift at Isha when you selling out fashion planet,German
0,771451_DirkSchnelleWalka-20090901-ajk_de10-042.wav,Avatar Syndicate,German
0,773325_1337ad-20170321-blf_de9-168.wav,an inspiration the actual computer connected but heart,German
0,774751_HeavensRevenge-20110529-mlp_de11-104.wav,tasvir,German
0,775564_DirkSchnelleWalka-20090901-ajk_de10-039.wav,kurti with an internet Sugan Kaun the first album,German
0,776946_AdrianTovar-20080727-xjh_de11-150.wav,strength of logging into a feeling,German
0,778163_AndreyBarrientosCostaRica-20130720-pyu_de10-008.wav,Dandiya Din text next rest for build digested so that the headphone built,German
0,778177_GeorgSimmel-20140421-fdc_de5-077.wav,Assamese women who evening p***,German
0,779032_HeavensRevenge-20110529-byr_de4-51.wav,Kishor 4 pending the silent homes Mahendra 30 Shankar nose and hair from falling tone,German
0,779195_AndreyBarrientosCostaRica-20130720-pyu_de10-003.wav,the dash telling form builder with backlight in them text is today loss,German
0,779905_Crazo-20091014-cey_de11-052.wav,Sudha soft man alone and give it your side effect,German
0,781106_Black_Galaxy-20080530-xzb_de11-095.wav,Yeshu ki testimony station Jewellers to schedule clean,German
0,781539_1337ad-20170321-yqy_de10-052.wav,NHS getfit software licensing,German
0,782881_1337ad-20170321-vyr_de3-63.wav,Shikha Gupta Rangwala,German
0,783203_DanielNeuhaus-20080303-zpn_de5-121.wav,I am doing this investigate,German
0,784040_HeavensRevenge-20110529-kux_de10-072.wav,piano vst galton achieve with hostel,German
0,784070_HeavensRevenge-20110528-tte_de11-124.wav,the traffic with an ambitious but some slight non beta vitagel item,German
0,785764_FlorianLaggwwwlaggat-20121008-lia_de4-72.wav,ya book,German
0,Error,Error,Error
0,786782_HeavensRevenge-20110529-lge_de11-041.wav,that's right and a button to form for 64,German
0,788167_BRwgt-20140228-yvz_de8-057.wav,team and I na sogan happens,German
0,788266_DirkSchnelleWalka-20140703-eyz_DirkSchnelleWalka-20140703-eyz_de8-002.wav,108 mantras for Shiva,German
0,788491_Black_Galaxy-20080530-xzb_de11-103.wav,when is dance for mute vada,German
0,788609_1337ad-20170321-kgs_de11-035.wav,Akhil account Samsung Aankhen hai man for behad,German
0,788713_GeorgSimmel-20140421-ndq_de11-164.wav,and sister sex tour in her chest as being his with Oscar lasted,German
0,789786_BRwgt-20140723-idz_de3-62.wav,full item is how much lucky,German
0,789964_HeavensRevenge-20110528-peo_de10-073.wav,m r software consumer session socialism,German
0,791592_BRwgt-20140718-hof_de9-176.wav,Mustafa garage weak students should not findon,German
0,791683_BRwgt-20140228-vcp_de8-055.wav,sneak consigned first kisses conceptual for Stephen,German
0,792103_ALI-20130113-iyl_de10-019.wav,1 month or text is known for refund list born,German
0,793299_HeavensRevenge-20110529-uiz_de11-109.wav,tourism for song filmmaker Future weather in October,German
0,793777_GeorgSimmel-20140421-ptj_de4-86.wav,Kis Desh Ne keep it off coach instruction and given it,German
0,795994_DanielNeuhaus-20080303-jla_de5-134.wav,tomato Hathi Swatantrata little awesome,German
0,798301_BRwgt-20140718-ynj_de4-13.wav,467 home with within cloth X convenience,German
0,799565_HeavensRevenge-20110529-wfp_HeavensRevenge-20110529-wfp_de2-06.wav,name the house to state Handloom shop,German
0,799717_AdrianTovar-20080727-paz_de3-18.wav,important Hindi nice look for in the soil to start with next and went far is,German
0,799729_1337ad-20170321-bej_de6-53.wav,Sachin cloud account should not have deleted,German
0,800911_HeavensRevenge-20110529-qmc_de6-52.wav,Tourister Van Austin for transfer health nurse,German
0,801973_HeavensRevenge-20110529-lid_de7-035.wav,to sign a contract for let's of broccoli is it was den,German
0,802077_HeavensRevenge-20110529-gbj_de9-143.wav,Sachin finished Amos class in concrete and abstract noun,German
0,802622_Defense-20090727-wmu_de7-052.wav,z1000 exam list above fit into a diffuser,German
0,803987_DirkSchnelleWalka-20140703-lys_de5-102.wav,Technology ka marks and written and spoken in Sweden,German
0,804750_BRwgt-20140723-idz_de3-65.wav,103 and this time name of fundamental and still is,German
0,805073_1337ad-20170321-hii_de9-144.wav,Sanatan Anam with hooks for concrete and Asphalt song,German
0,806072_Crazo-20091014-rfm_de7-011.wav,lyrics of waiting list of lists clerk of fun and useful to Sakta siling,German
0,806671_HeavensRevenge-20110528-rms_de10-036.wav,skit on Android land,German
0,807608_HeavensRevenge-20110529-ibo_HeavensRevenge-20110529-ibo_de11-004.wav,taking doston on top of the chief minister of mines office online,German
