,Filename,text,language
0,808604_HeavensRevenge-20110528-woz_de9-148.wav,urinoma actions by fear and aft,German
0,809335_HeavensRevenge-20110529-qmc_HeavensRevenge-20110529-qmc_de6-48.wav,transit plastic Karbonn,German
0,810054_HeavensRevenge-20110529-ghq_HeavensRevenge-20110529-ghq_de11-143.wav,sq feet square formed if I had transfer,German
0,810401_BRwgt-20140718-ynj_de4-22.wav,the Orchid sqlite in the suffering study skills its difficult,German
0,812203_DirkSchnelleWalka-20101217-iws_de11-099.wav,the following is the correct language going to return,German
0,812267_GeorgSimmel-20140421-zvj_GeorgSimmel-20140421-zvj_de8-050.wav,M hu S 500 rupee note there in and focus in heart,German
0,813524_BRwgt-20140228-zpn_de11-023.wav,10 cute so Kapda Market closed and Communications method,German
0,814246_HeavensRevenge-20110528-woz_de9-144.wav,ticker symbol and truth for concrete marriage palace song,German
0,814558_Crokoking-20110119-dbi_de10-152.wav,Azad restaurant Rashid love,German
0,816924_Defense-20090727-wlz_Defense-20090727-wlz_de5-083.wav,top 10 NIT in files and at 28 M whose and must,German
0,817163_AndreyBarrientosCostaRica-20130710-hct_de5-059.wav,Deepak jewellers and shadows height weight,German
0,817802_DanielNeuhaus-20080303-zpn_de5-122.wav,ending the first wife,German
0,819960_GeorgSimmel-20140421-wyw_de4-01.wav,storm first sloka Sthan AC meet Keshav first look,German
0,821143_HeavensRevenge-20110528-tte_HeavensRevenge-20110528-tte_de11-123.wav,tension at an beta slider Oscar philim,German
0,822188_BRwgt-20140228-zpn_de11-025.wav,Mithila Wale Hath sister class,German
0,824023_HeavensRevenge-20110529-ujo_de2-12.wav,and I am sure that there are few side Fallen,German
0,825389_BRwgt-20140718-oxg_de8-073.wav,P computer condition in a hiatus lands are so pathetic and,German
0,825601_HeavensRevenge-20110529-lvg_de9-145.wav,Dekho Samantha Amit Yadav,German
0,826856_HeavensRevenge-20110529-lge_de11-040.wav,Flipkart Vodafone m s,German
0,826943_FrankJger-20111114-zmx_de5-042.wav,the actress wear to chahita shreshth,German
0,827791_1337ad-20170321-vzg_de9-056.wav,Johns Honda 363 menu,German
0,827993_AdrianTovar-20080727-iif_de10-135.wav,Manzil to product from glyco hairstyle r7,German
0,828725_Defense-20090727-wmu_de7-053.wav,King Radha Krishna station for house,German
0,829005_HeavensRevenge-20110528-bno_de6-14.wav,I am with you understood it in and truths for Pisces,German
0,829621_Crazo-20091014-jzh_de5-005.wav,respiratory distress missing Chef system,German
0,Error,Error,Error
0,831621_AndreyBarrientosCostaRica-20130710-hct_de5-056.wav,I need soda by the fat rat listen them,German
0,831909_HeavensRevenge-20110528-woz_de9-150.wav,I just am I would internet from their future screen,German
0,832010_1337ad-20170321-yqy_de10-059.wav,and function of the midst of a firm's behaviour of clay,German
0,832351_HeavensRevenge-20110529-mlp_de11-105.wav,toastmasters at student grade 11 415 plate,German
0,832591_1337ad-20170321-czb_de11-099.wav,for wonderful an interesting twist to the baron,German
0,832961_HeavensRevenge-20110528-peo_de10-068.wav,substance a good plan the staff that industry and inside EP list,German
0,833368_AdrianTovar-20080727-xjh_de11-148.wav,what items can eat in skin fungus,German
0,833386_GeorgSimmel-20140421-cgr_de7-056.wav,US patent be Aankhon Ki Hathon,German
0,833411_de11-068.wav,staff lyric list prices for Santro Xing,German
0,835493_DanielNeuhaus-20080303-cxf_de2-38.wav,on Christmas in the China talk to me on the sofa,German
0,838538_BRwgt-20140228-ewk_de8-065.wav,Chinese beast inside phone to band that violin,German
0,839463_1337ad-20170321-bej_de6-55.wav,sequence Na Koi enclouden definitive usko Chandrayan,German
0,839518_GeorgSimmel-20140421-ptj_de4-87.wav,kuch kharab shop in Solan comedian bearing,German
0,840927_HeavensRevenge-20110529-klu_de7-068.wav,denom aapka Sar per computics Forever 21,German
0,842504_HeavensRevenge-20110529-nhk_de9-167.wav,Pitaji Ne starts on where is the on restart right now of marketing to Asia,German
0,843568_DanielNeuhaus-20080303-cxf_de2-31.wav,Rishte abstain the cake in which things are influenced on 3 September fall,German
0,843638_HeavensRevenge-20110529-lvg_de9-144.wav,the cost in half an hour and with super soco create Marathi trailer song,German
0,844437_HeavensRevenge-20110529-ghq_de11-151.wav,mithaai number via Council for most awaited,German
0,845138_HeavensRevenge-20110528-wng_de3-46.wav,main board is an instruction the net pack kathaen report,German
0,846713_HeavensRevenge-20110528-fum_de4-09.wav,he places Isha Hut menu is in place when the software is correct and that your,German
0,847732_HeavensRevenge-20110529-ibo_de11-006.wav,b a 5 standard started falling,German
0,848335_DirkSchnelleWalka-20101217-swz_DirkSchnelleWalka-20101217-swz_de7-074.wav,Little Pony in high finance house ke number,German
0,848977_1337ad-20170321-yqy_de10-060.wav,Bayana forecast of Khush Lawson,German
0,849613_1337ad-20170321-vyr_de3-57.wav,technique is not used,German
0,850619_Crazo-20091014-jzh_de4-97.wav,making Slime internet telephone if you will,German
0,851008_DanielNeuhaus-20080303-jzi_de4-66.wav,in the Eastern Healthcare it is transaction yahoo.co 32 it influenced,German
0,851395_DanielNeuhaus-20080303-cxf_de2-32.wav,to stand out in the restaurant or Cafe with sign,German
0,852676_1337ad-20170321-czb_de11-104.wav,respect women height get hard f******,German
0,852764_GeorgSimmel-20140421-ptj_de4-82.wav,Santosh and key strength is not thinking,German
0,855477_HeavensRevenge-20110528-ahk_de10-097.wav,ki mithaai longwood a m my music near,German
0,856275_GeorgSimmel-20140421-ndq_de11-169.wav,Vincent Cassel,German
0,857283_Crokoking-20110119-dbi_de10-149.wav,umah Navratri geet Mishra,German
0,857570_BRwgt-20140228-yvz_de8-059.wav,kis IPL Kaise Prestige use I know more,German
0,858683_1337ad-20170321-bej_de6-48.wav,transact plastic ke born,German
0,858735_1337ad-20170321-mba_de7-021.wav,School first place where is enjoy,German
0,858895_1337ad-20170321-qbd_de2-35.wav,Asha Anushka Kanwar ingested,German
0,859431_1337ad-20170321-mba_de7-018.wav,kya hun Aaj Disha act to stinney confessed for letting us warns and soil,German
0,859994_HeavensRevenge-20110528-ory_de4-18.wav,people in a restaurant listening,German
0,860757_DirkSchnelleWalka-20090901-ajk_DirkSchnelleWalka-20090901-ajk_de10-038.wav,class room Sultan even when the tautan Zealand,German
0,861918_HeavensRevenge-20110529-llt_de7-094.wav,Manoj sisterxsister Disha headphone wireless LAN forgiving where they go,German
0,862560_HeavensRevenge-20110529-tng_de8-118.wav,within few months take the fiction books of inorganic sources,German
0,863764_HeavensRevenge-20110529-nhk_de9-173.wav,Inferno an investigative journalist is problem loss nucleus,German
0,865898_HeavensRevenge-20110529-byr_de4-55.wav,is a software understood fascino protocol,German
0,866142_GeorgSimmel-20140421-ptj_GeorgSimmel-20140421-ptj_de4-78.wav,cast Alaukik kitne varsh,German
0,867014_1337ad-20170321-qbd_de2-40.wav,the sun just less the head of a ton,German
0,868733_GeorgSimmel-20140421-cgr_de7-052.wav,task is such an action list above film peace review,German
0,869579_DanielNeuhaus-20080303-jzi_de4-71.wav,reproductive monthly platform in all the ocean,German
0,869624_DanielNeuhaus-20080303-hfe_de3-53.wav,vitamin test and strike coupon for environment Orton Kaisan that contain foreman,German
0,870905_BRwgt-20140718-oxg_de8-068.wav,Tata fakirpur antim computer network by the Goliath,German
0,870928_BRwgt-20140228-nrb_de11-137.wav,teamindus five star resort in Munnar with Jagan,German
0,871507_1337ad-20170321-hii_de9-143.wav,the thinnest outlet in concrete and fires on the day after,German
0,872304_BRwgt-20140718-hof_de9-172.wav,document controller in London,German
0,879930_HeavensRevenge-20110528-peo_de10-071.wav,s s enterprise where the software,German
0,881459_HeavensRevenge-20110529-lge_de11-038.wav,sign up to game on this mistake,German
0,881965_HeavensRevenge-20110529-ujo_de2-13.wav,is very in fun fun and exciting,German
0,882529_HeavensRevenge-20110529-llt_de7-093.wav,Nitish Manisha Heights MN all show schema,German
0,882692_HeavensRevenge-20110529-uiz_de11-112.wav,tamatar Hota I can stand back up photo,German
0,883308_AndreyBarrientosCostaRica-20130710-hct_de5-058.wav,dissolution of a track of feeder after loss can,German
0,884533_BRwgt-20140228-kwo_de8-123.wav,Prithvi annual function Lok,German
0,884956_BRwgt-20140228-qlo_de8-102.wav,when it comes to mi calendar,German
0,885737_de11-066.wav,awesome internet filters,German
0,886118_BRwgt-20140228-kwo_de8-114.wav,name in CTET child who have,German
0,887504_1337ad-20170321-vyr_de3-56.wav,is the technique with a weekend fun facts couldn't have ended,German
0,887670_BRwgt-20140723-idz_de3-61.wav,despite the fact,German
0,888336_BRwgt-20140228-yvz_de8-062.wav,computer centre 3rd floor 9 import inline IP address,German
0,888486_HeavensRevenge-20110529-qmc_de6-57.wav,enjoy your gains by severe and unsolicited Fatak solar system together,German
0,889212_Black_Galaxy-20080530-xzb_de11-102.wav,written exam,German
0,889405_1337ad-20170321-ufl_de3-38.wav,Thane Station East Indian food site and height,German
0,889497_1337ad-20170321-vyr_de3-54.wav,it starts on common in schools on the text music on fans in in f****,German
0,890146_BRwgt-20140228-vcp_de8-051.wav,chut athleisure software can and fast in study of violin,German
0,892059_HeavensRevenge-20110529-qmc_de6-51.wav,is it safe to visit lekin halftones Bajrang Congo com,German
0,893264_Crazo-20091014-cey_de11-056.wav,the same function grid competitors digital is it also work,German
0,895456_1337ad-20170321-mba_de7-013.wav,anonymous ke message and I would buy an Assassin's Creed and will it,German
0,900783_1337ad-20170321-vzg_de9-061.wav,conveyor and fertility in scabies,German
0,900839_HeavensRevenge-20110529-llt_de7-089.wav,when I'm with cheap car have never of internet for one that we are in soil,German
0,900945_HeavensRevenge-20110529-dif_de11-068.wav,Toyota Rush price of lyric list rice exports and notes,German
0,902053_1337ad-20170321-kgs_de11-037.wav,villains Akhilesh and fast and their classrooms and finger 1,German
0,902410_BRwgt-20140228-nrb_de11-136.wav,slightly spectral synthesis 1015,German
0,903908_HeavensRevenge-20110529-lzj_de10-022.wav,sammanit Sujan hadtal Mandi kalapahad,German
0,904013_BRwgt-20140228-zpn_de11-024.wav,teacher technique for Din in b b cream can I use it,German
0,904477_BRwgt-20140228-qlo_de8-098.wav,PPP Kumbh quotes on top position when the given stick and so forth craft,German
0,905406_HeavensRevenge-20110528-tte_de11-130.wav,Alastair Cook for heart want to be determined,German
0,905418_Defense-20090727-wmu_Defense-20090727-wmu_de7-048.wav,chicken dishes with besan,German
0,905862_FlorianLaggwwwlaggat-20121008-lia_de4-76.wav,Hindi song,German
0,906985_AndreyBarrientosCostaRica-20130720-pyu_de10-010.wav,is after a Asian photo to Sen,German
0,907529_BRwgt-20140718-hof_de9-168.wav,I need inspiration the attitude computer instant mixed in with heart,German
0,907659_HeavensRevenge-20110529-klu_de7-066.wav,vegetables we are a few an metal power 4 members,German
0,908242_HeavensRevenge-20110528-rms_de10-033.wav,I'm aapke Build A pillar satwari helped her Konta Kalam born,German
0,908532_AndreyBarrientosCostaRica-20130710-hct_de5-062.wav,fear the freshmuzic.in meet finlayson schedule,German
0,910061_BRwgt-20140718-ynj_de4-17.wav,time organs trade strike over step of Asansol gana,German
0,910177_BRwgt-20140228-ewk_de8-064.wav,and Fourth Kind of an einem Hukum,German
0,910985_HeavensRevenge-20110529-tng_de8-112.wav,Facebook ID interior file and a back start,German
0,912428_1337ad-20170321-blf_de9-159.wav,use and abuse of images in an account,German
0,913347_HeavensRevenge-20110529-tng_de8-119.wav,cancel the Indian Gangster in,German
0,914908_HeavensRevenge-20110529-byr_HeavensRevenge-20110529-byr_de4-46.wav,Vaishno Devi inside in the sky national capital is most,German
0,916541_HeavensRevenge-20110529-lge_de11-036.wav,whimsically account Bhagya 800 game,German
0,917909_1337ad-20170321-amr_de4-72.wav,about a function in Facebook in contact information,German
0,918229_HeavensRevenge-20110529-lzj_de10-018.wav,Krrish 1,German
0,920843_HeavensRevenge-20110528-bno_de6-15.wav,against the fat workout leg workouts to gain,German
0,921152_1337ad-20170321-blf_de9-163.wav,police Circus the allowed in internet Shubh Rang normal Kaise pass,German
0,921396_Crazo-20091014-rfm_de7-005.wav,what's weaknesses of soil,German
0,922699_GeorgSimmel-20140421-ptj_de4-80.wav,Nathu Vishnu Shastra Vishay at Kent 2nd Vishnoi experimented with bearing,German
0,925561_HeavensRevenge-20110529-rju_de9-044.wav,Daru Vich Pyaar star to show IP addresses Amulya,German
0,926389_ALI-20130113-iyl_de10-020.wav,Tekken 10 men belt white clisson Bayan,German
0,926465_AdrianTovar-20080727-gov_de2-24.wav,holston sistemas De este,German
0,926570_BRwgt-20140718-hof_de9-175.wav,with sparkles khanan delicious tilgan,German
0,926733_BRwgt-20140228-bgs_de8-029.wav,I National internet Sugam is not pending,German
0,926871_HeavensRevenge-20110529-nhk_HeavensRevenge-20110529-nhk_de9-164.wav,criminal of political awareness as I can get lost,German
0,927992_Defense-20090727-wmu_de7-057.wav,tonometer with yet another split unit and last,German
0,928198_BRwgt-20140228-zpn_de11-018.wav,I not a good job is it the stipulated,German
0,928698_HeavensRevenge-20110528-wng_de3-43.wav,Jharkhand field was first time,German
0,931909_1337ad-20170321-vyr_de3-60.wav,koshika Sanskriti museum,German
0,932654_HeavensRevenge-20110529-qmc_de6-55.wav,Vikram son of cloud definition,German
0,932777_1337ad-20170321-czb_de11-098.wav,Monu station to wind infinitheism threat on h,German
0,935995_DirkSchnelleWalka-20101217-iws_DirkSchnelleWalka-20101217-iws_de11-096.wav,15 December 2016 - fund in pond,German
0,936084_GeorgSimmel-20140421-fdc_de5-080.wav,Indian acrylics site would in the castle in Unki part,German
0,936697_HeavensRevenge-20110529-ibo_de11-011.wav,no quite name them giving dost along some spoken distance,German
0,937115_HeavensRevenge-20110529-mdg_de8-035.wav,35 a v Sonia technology and gadgets,German
0,938482_HeavensRevenge-20110529-dif_de11-067.wav,yesucan banota class first click,German
0,938624_HeavensRevenge-20110529-ghq_de11-147.wav,the first second if I had to of a bit software on h cassettes,German
0,939430_AdrianTovar-20080727-bxq_de11-073.wav,that was with suitable site,German
0,940328_HeavensRevenge-20110529-rju_de9-047.wav,after meal on Thursday and then free Baat next vacancy of you go,German
0,940926_BRwgt-20140228-kwo_de8-116.wav,industrial court in sites to find Z Sim,German
0,943304_HeavensRevenge-20110528-wng_de3-48.wav,top 10 cricket white amphicyon price in the capacity of,German
0,944096_HeavensRevenge-20110529-mlp_de11-111.wav,useful and association for testing and anna and,German
0,947516_HeavensRevenge-20110529-byr_de4-53.wav,Pisces and cancer 4:00 and thus kostenlos program,German
0,948041_AnnaKarpekewitsch-20091129-jbu_de9-025.wav,get a computer South server that I can access,German
0,948171_AdrianTovar-20080727-gov_de2-21.wav,death Bell Court confirm sign miscellany,German
0,949156_DanielNeuhaus-20080303-zpn_de5-118.wav,Sach invest of solute,German
0,951632_Defense-20090727-wlz_de5-089.wav,Shahrukh Khan ki Badshah film geet,German
0,952410_HeavensRevenge-20110528-rms_de10-031.wav,fisherman National fashion Maxi Malviya,German
0,952651_Crazo-20091014-jzh_de4-99.wav,Minakshi opposite,German
0,954008_1337ad-20170321-vzg_de9-059.wav,Anup 1616 10 September 2002 suspected of killing,German
0,954431_HeavensRevenge-20110529-llt_de7-096.wav,is Ek Rishta ka naam internet Nach Baliye,German
0,954652_DirkSchnelleWalka-20101217-iws_de11-102.wav,Sarkari exam,German
0,955676_BRwgt-20140228-kwo_de8-120.wav,3 friends hybels mission Din bhai Lakshman chicken,German
0,956069_DirkSchnelleWalka-20090902-qoy_de5-037.wav,confirm,German
0,957322_BRwgt-20140228-msx_de8-139.wav,size of shared folder,German
0,959468_HeavensRevenge-20110529-lvg_de9-150.wav,Jesus came award M internet from their face cream,German
0,960491_BRwgt-20140228-ewk_de8-067.wav,Rajasthan Fakeer Sthan Olympus to import and decrement,German
0,960539_HeavensRevenge-20110529-rju_de9-042.wav,sitecom 45 and long IP address over the first click,German
0,963547_1337ad-20170321-qbd_de2-37.wav,Hukum film star house ke nuskhe Warren,German
0,963773_BRwgt-20140228-msx_de8-143.wav,3 month Amit with H2S 2009 Hashmi,German
0,964938_HeavensRevenge-20110529-gbj_de9-137.wav,Kitna Sona Hai for Stanford And Everything has all of one sim to another Sim,German
0,965448_1337ad-20170321-czb_de11-096.wav,Semen analysis inventor,German
0,966563_HeavensRevenge-20110529-tng_de8-117.wav,tensed India Expo 19 and reimbursement love,German
0,969130_FrankJger-20111114-zmx_de5-047.wav,Kolkata,German
0,971576_DirkSchnelleWalka-20101217-iws_de11-098.wav,demonstration theory in paragraph 100 words,German
0,972398_GeorgSimmel-20140421-cgr_de7-060.wav,tp53 per,German
0,974894_BRwgt-20140228-zpn_de11-017.wav,Olivia ka miss MIT Anandpur design,German
0,976050_1337ad-20170321-ufl_de3-42.wav,enough Kutumb with her fifties and about her plan,German
0,977241_BRwgt-20140228-kwo_de8-118.wav,with a few homestake the fiction books of the excess Jivan,German
0,978621_HeavensRevenge-20110529-qmc_de6-49.wav,invention of you must shader cache answers 8 science,German
0,979492_HeavensRevenge-20110528-ezs_de3-12.wav,Fox aur thoughtfortheday Mouse Lancer Saman,German
0,980688_GeorgSimmel-20140421-fdc_de5-083.wav,top picnic even Falls and Arctic m v Cinemas,German
0,981190_Crazo-20091014-jzh_de4-98.wav,kings of fermented milk e Shahbaz of national arts,German
0,982609_HeavensRevenge-20110529-nhk_de9-171.wav,deserto comment how is mitana Digital Photography year,German
0,984403_HeavensRevenge-20110529-ghq_de11-152.wav,staff portal so we are going out that,German
0,984485_Defense-20090727-wlz_de5-088.wav,skip the price under 1000 km Atlantic Vista,German
0,985813_HeavensRevenge-20110529-kux_de10-067.wav,list of insider coronavirus came on the Contender lately and,German
0,985815_Crokoking-20110119-dbi_de10-147.wav,Hukum specialised it outside Islam,German
0,986567_HeavensRevenge-20110529-uiz_de11-107.wav,if it Park headphone gateways in London David,German
0,986787_1337ad-20170321-ntd_de11-138.wav,staff physics book and staff common,German
0,987658_DanielNeuhaus-20080303-zpn_de5-124.wav,play the phone the absolute,German
0,988978_1337ad-20170321-blf_de9-162.wav,Instagram drawings on Sitar zone of Indian Parliament and name tyre,German
0,990718_BRwgt-20140228-bgs_de8-023.wav,can give your life thank you Santosh message deleted,German
0,990919_HeavensRevenge-20110528-ezs_de3-18.wav,and puts us in donors list for when a social stratification is done when forest,German
0,990981_HeavensRevenge-20110529-dif_HeavensRevenge-20110529-dif_de11-060.wav,Jesus format with effects at least twice as core exercise,German
0,991117_HeavensRevenge-20110529-lvg_de9-148.wav,urinoma after friends by Pia and staff,German
0,991906_HeavensRevenge-20110529-nhk_de9-169.wav,Manas age for admission for staff travel tips with me,German
0,992069_1337ad-20170321-kgs_de11-043.wav,cake in an exactly shape for boots for school,German
0,993080_BRwgt-20140228-bgs_de8-024.wav,TIFR bol Anthony School sets list of Finance fixed deposits on pixels,German
0,994052_HeavensRevenge-20110528-ory_HeavensRevenge-20110528-ory_de4-09.wav,he pleases Shah arts magazine fluteless when the software used for rectangular clothes,German
0,994084_HeavensRevenge-20110529-wfp_de2-07.wav,where is first AC and candy house popularmmos afternoon,German
0,994667_HeavensRevenge-20110528-ahk_de10-096.wav,digital logic network,German
0,995357_DirkSchnelleWalka-20090901-ajk_de10-041.wav,an Din download points of the activities,German
0,997153_1337ad-20170321-bej_de6-49.wav,invasion of your most CD ka transit Pathan,German
0,998929_HeavensRevenge-20110529-mdg_HeavensRevenge-20110529-mdg_de8-030.wav,tazloc fresh bataen form no in Maitrivanam,German
0,999152_HeavensRevenge-20110529-kux_de10-070.wav,movie review on political on website,German
0,999252_1337ad-20170321-czb_de11-097.wav,conflicts with system is Oscar shasan,German
